title,date
"Gasoline Prices Expected To Rise, But Nobody Is Saying When. ",1986-11-04
A Tax On Imported Oil May Be Due. ,1986-11-27
Robert Walters... Case For Tax On Imported Crude Oil. ,1986-12-01
The Case For An Oil Tax. ,1986-11-21
Ultramar Pumps Up Price Of Gasoline 2 Cents A Litre. ,1986-11-05
A Good Time For New Import Tax On Oil. ,1986-11-23
Jo Years. Fishing-Is &Ood For The Soulf... In Washington The ,1986-11-19
Long-Term Outlook Good For Oil Company Stocks. ,1986-11-21
Yamani Strategy Was Sidestepped. Victor Bienstock. ,1986-11-04
Egypt Hoping For More Oil From Desert. ,1986-12-01
"Mexico, Us. Sign Oil Deal Fhat Might Total $R. ",1986-11-14
Oil Output Plummets. ,1986-11-20
World's 2nd Largest Firm Disappointed With Profit. ,1986-11-07
"Ultramar, Shell Boost Prices For Gas At Outaouais Stations. ",1986-11-05
The Argus-Press ,1986-11-22
The Tuscaloosa News ,1986-11-02
Rising Crude Oil Costs Cited As Gas Prices Rise Two Cents. ,1986-11-17
Japan Oil Refiners May Trade In Us. ,1986-11-13
Winter Energy Outlook Said Good. ,1986-11-26
Opec Output Needs Estimated. ,1986-11-12
Opec Panel Seeks $18 Oil; Leaves Production Issue Open. ,1986-11-16
Gas Prices May Have Bottomed Out. ,1986-11-14
Crisis Forges Consensus Among Oil Producers. ,1986-11-23
Oil Production Is Reported Declining In Lower 48 States. ,1986-11-21
Exec Wants Minimum Oil Price. Api Head Thinks Plan Is Only ,1986-11-12
Exec Wants Minimum Oil Price. Api Head Thinks Plan Is Only ,1986-11-12
Minimum Floor Price Asked For Domestic Oil. ,1986-11-12
Staying Warm Will Cost Less This Winter. ,1986-11-24
World's Oil Prices Smooth Out. ,1986-11-01
Opec Eyes Crude Barrel Price Of $18. ,1986-11-15
Upgrader Site Waiting For Giant Hydroprocessor ,1986-11-10
Shell Disappoints In The Third Quarter. ,1986-11-07
Shell Disappoints In The Third Quarter. ,1986-11-07
The Phoenix ,1986-11-24
Using Oil Imports Eyea. ,1986-11-27
Saudi Change Brings A Surge In Oil Prices. By Kenneth. N. ... ,1986-11-02
Lroodyear May Ry. Lo.. Stop Goldsmith Takeover Attempt With ,1986-11-04
Energy Futures Prices Take A Beating. ,1986-11-25
The Albany Herald ,1986-11-25
Goodyear May Try To Derail Takeover. ,1986-11-04
Imperial Lone Holdout In Gasoline-Price Rise. ,1986-11-06
The Wrong Answer. Bv William Murchison ,1986-11-30
Higher Interest Rate Fears Abate. ,1986-11-04
Higher Interest Rate Fears Abate. Cheaper Money Were ... ,1986-11-04
Neport Advises Governmen To Tap Wildlife Region's Oil. ,1986-11-25
Sought For Oil. ,1986-11-24
Shell Oil At The Center Of Apartheid Sanctions Busting Row. ,1986-11-06
Plans Revealed For Oil Development. ,1986-11-24
Saudi Move Leaves Opec Dilemma Unsolved. ,1986-11-16
What Direction Opec After Yamani? ,1986-11-16
What Direction Opec After Yamani. ,1986-11-12
Yamani's Firing Signals New Saudi Tactics. ,1986-11-16
Arctic Oil Field Drilling Proposed. ,1986-11-24
Gettysburg Times ,1986-11-06
Pittsburgh Post-Gazette ,1986-11-06
Metals Futures Take Unorthodox Drop. ,1986-11-06
American Traders Ship Saudi Oil To Iran By Jeff Gerth. ,1986-11-23
Oil Executive Pleads For Minimum Floor'. ,1986-11-12
Oil Executive Pleads For Minimum Floor'. ,1986-11-12
Providence: Connecticut: Massachusetts: ,1986-11-23
American Traders Nave Been Ferrying Oil To Iran ,1986-11-23
Fuel Reportedly Shipped To Iran By Us. Traders ,1986-11-23
Williamson Daily News ,1986-11-17
But Opposition Forming. Drillers Eye Alaskan Wilderness. ,1986-11-24
Bass Strait Oil Output Up By... ,1986-11-28
"Saudi King Wants Sus20 Oil Price, Says Libya. ",1986-11-03
"More Oil, Gas In Alaskan Refuge. ",1986-11-24
Congress Told To Consider Arctic Drilling... ,1986-11-25
Egypt Raises Oil Prices By S 1.60 ,1986-11-21
Reagan On Import Fee Fence Deal On Suffield. ,1986-11-15
Arctic Area Sought For Oil And Gas. ,1986-11-24
Tis The Season ,1986-12-01
The Glasgow Herald ,1986-11-21
Precious Metals Futures Orices Plunge. ,1986-11-15
"Tube Imports Over Limit, Panel Finds. ",1986-11-04
Oil Prices Climb As Traders Bet On Opec Cutback. ,1986-11-01
National Briefs. Minimum Us. Oil Price Called For ,1986-11-10
Crude Oil Production Falls. ,1986-11-20
Opec Panel Adopts Price For Crude Oil. ,1986-11-16
Backing For Pump Project If. Jr ,1986-11-10
Industry Calls For Tax Restructuring. ,1986-11-26
Opec To Discuss Price Hike. ,1986-11-11
The Phoenix ,1986-11-20
Gettysburg Times ,1986-11-24
Ottawa Citizen ,1986-11-07
Edmonton Journal ,1986-11-06
Petroleum Products Demand To Slow. ,1986-11-09
The Indian Express ,1986-11-28
Fewer Jobs Open For Professionals. ,1986-11-08
Jova Com. Looks For Partners. ,1986-11-15
More Job Losses Likely In Energy Sector: Study. ,1986-11-19
Rianes Auack Maltese Oil Tanker. ,1986-11-27
Gas And Oil Are Bargains For Holidays. ,1986-11-28
Deadline On Port Dispute Nears. Ray Purdy. A Spokesman Tor ,1986-11-05
Precious Metals Go. Go Into Into Steep Decline H. ,1986-11-22
Growth In Oil Demand May Slow. ,1986-11-08
Lee To Retire At Chevron Next Month. ,1986-11-27
Oil Prices Fall After Saudi Statement. ,1986-11-25
For Pump Project. ,1986-11-10
State To Review Oil Brine Rules Regarding Pollution ... ,1986-11-07
Iraq Claims 48 Killed In Attack. ,1986-11-26
Exemptions Sought For Pollution Cap In Oil-Brine Issue. ,1986-11-07
Baghdad Attack Kills 48. ,1986-11-25
Pumping Up The Price. ,1986-11-17
Pumping Up The Price. ,1986-11-17
Saudis Sang Overtures To Iran Also ,1986-11-23
48 Reported Killed During Missile Attach. ,1986-11-26
Iranian Missile Strikes Baghdad Residences. ,1986-11-26
48 Reported Killed In Iraq... Iran Missile Hits Residential ... ,1986-11-26
Third Quarter Profits Dip For British Petroleum. ,1986-11-21
"Strain On Opec Agreement May Bring Lower Oil Prices, Experts ",1987-02-26
Aramco's Deal May Bring Price Stability. ,1987-02-06
Analysts Tell Investors Situation Ripe To Sell Fullv Priced ... ,1987-02-12
3as Prices Apparently Headed Downward Due To Oil Glut. ,1987-03-01
Iras Prices Expected To Decline. ,1987-03-01
"Gas Prices Will Fall A Little, Experts Say But Don't Expect ... ",1987-03-01
"Gasoline Prices Should 90 Down... After Recent Rise, Experts ",1987-03-01
Gasoline Prices Headed Down. ,1987-03-02
Analysts Say Gasoline May Be Cheaper Soon ,1987-03-01
Gas Prices May Head Down. ,1987-03-02
Gasoline Prices Expected To Fall. ,1987-03-01
"Opec Support Price Unraveling, Could Hit Low Teens... You ",1987-02-26
Downward Trend Seen In Gas Prices. ,1987-03-01
Gasoline Prices May Take Dive. ,1987-03-01
Petroleum Industry Experiences Fallout. ,1987-02-23
To Regain Oil Dominance. ,1987-02-03
Gasoline Price Dip Linked To Surplus. ,1987-02-28
The New Alaskan Energy Frontier. ,1987-02-03
Opec Oil Agreement Is Under Strain ,1987-02-26
Gas Prices May Drop Due To Worldwide Oil Surplus. ,1987-03-01
"D2 Business Thursday-February 26, 1987. Opec Agreement May ",1987-02-26
Oil Prices May Continue Fall. ,1987-02-25
Petroleum Fallout ,1987-02-16
Petroleum Fallout. ,1987-02-06
We're Heading For Future Energy Crises'. ,1987-02-02
We're Heading For Future Energy Crises'. ,1987-02-01
Nation's Oil Output Will Continue To Fall Despite World Price. ,1987-02-26
Education And Oil Mix. ,1987-02-03
Robert Walters... Education And Oil Mix In Louisiana. ,1987-02-11
A Mixture Of Oil And Education ,1987-02-05
Wilson Urges Boycott Over Gas-Price Rise. ,1987-02-21
Opec May Need Output Cut To Maintain Price. ,1987-02-09
Energy Researchers Favor Bigger Petroleum Reserve. ,1987-03-02
Problems Threatening Opec's Oil Agreement. ,1987-02-26
Bearish Market Sends Oil Futures Prices Below $17 Us. ,1987-02-25
Commodities ,1987-02-25
Educ First Gush Of Alberta. ,1987-02-07
Us Oil Production Likely To Fall. ,1987-02-25
Texaco Head: Higher Prices In Future. ,1987-02-10
Wholesale Prices. Up 0.6 In January; Crude Oil Jumps. ,1987-02-13
Group Says $10 A Barrel Oil Tariff Would Cost Us. $100 ... ,1987-02-16
Kuwait Restores Fixed Crude Oil Prices To Stabilise Market. ,1987-02-03
Drop In Domestic Oil Production Predicted. ,1987-02-26
Oil Futures Sink Below $17 A Barrel. ,1987-02-25
Crude Oil Offers Five Options. ,1987-02-02
Schenectady Gazette ,1987-02-12
"Oil Slide Temporary, Analysts Predicting. ",1987-02-27
Gasoline Prices Expected To Begin Falling In May. ,1987-03-01
Point Pleasant Register ,1987-02-18
Oil Production Slide To Continue. ,1987-02-26
Oil Hikes Cause Wholesale Price Jump. ,1987-02-13
Oil Prices Slide Again To $16 A Barrel Range. ,1987-02-26
Toledo Blade ,1987-02-22
Us Study Foresees New Oil-Import Crisis In 1990s. ,1987-02-24
Oil Prices Slump Over Worries On Opec Accord. I. Mont ,1987-02-24
Opec's Campaign For Higher Prices Boosted By Aramco Deal ,1987-02-05
"Worst Is Over For Refineries, Says Expert. ",1987-02-22
Oil And Gas Funds Again Producing. ,1987-02-24
Slipping Back Into Oily Trap. ,1987-02-10
Texaco Announces Net Income For 1986 Declined 84 Percent,1987-02-27
Opec Postpones Talks Amid Price Problems. ,1987-02-21
Centre Concerned Over Stir Against Refinery. ,1987-02-02
Home Sales Plunge At Record Pace. ,1987-02-26
In Washington How Education And Oil Mix. ,1987-02-12
Factory Orders Plunge. ,1987-02-26
Us Oil Futures Prices To Go Even Lower Rast Tacts. ,1987-02-26
Oil Prices Decline To Lowest Recent Levels. ,1987-02-26
"Esso, Bhp Want Tax Cut. ",1987-02-19
Kuwait Warns To Buy At Opec's Set Prices. ,1987-02-23
Anthony Harrigan Us. Relying More On Foreign Oil. ,1987-02-03
Wholesale Prices Show Largest Rise Since 85. ,1987-02-12
New Us. Oil Crisis Feared In 90s. ,1987-02-23
Decline In Oil Prices Reflects A Market Glut. ,1987-02-26
2 Refineries Will Halt Operations. ,1987-02-05
Buying Saudioil At A Fixed Price. ,1987-02-05
"Oil Prices Continue Tumble, Fall To Lowest Level In 1987. ",1987-02-26
Prices Slide To Lowest Level . ,1987-02-26
Oil Prices Slide Toward $16 A Barrel; Opec Wavering. ,1987-02-26
People Will Be Sitting In Gas Lines A. ,1987-02-21
'Oil Patch9 Slump May Spell Crisis. ,1987-02-06
Analysts Warn That Us. May Be Hit By Severe Oil Shortage. ,1987-02-17
Oil Futures Take Technical Downturn. ,1987-02-12
Opec Cheats Force Oil Lower. ,1987-02-27
Exemption Urged For Small Oil Weils. ,1987-02-04
Oil Prices Tumble. ,1987-02-26
Oil Prices Stay Below Opec Target. ,1987-02-26
Falling Oil Prices Dip Into ,1987-02-26
Manila Standard ,1987-02-24
Earnings Said Down 68 Percent. ,1987-02-03
Three Rivers Man Injured In Accident. ,1987-02-08
Make Jump. ,1987-02-13
Group Says $10 A Barrel Oil Tariff Might Cost $100 Billion A ... ,1987-02-16
Remember The Long Lines? ,1987-02-15
"Oil Prices Drop, Reflect Market Glut, Refusal To Purchase ... ",1987-02-26
Chevron: First Loss Since Depression ,1987-02-13
Doubts About Opec Sink Energy Prices. ,1987-02-24
Outlook For Gas Prices Improving After Climb. ,1987-03-03
Toledo's Refineries. Two Pe-I. ,1987-02-01
St. Joseph Gazette ,1987-02-26
Commodities ,1987-02-24
"Gas Prices Dropping, Glut Cited. ",1987-03-01
"Oil Pricing Only To Suit Government, Says Bhp. ",1987-02-26
Oil Prices Slide Toward $16 A Barrel Associated Press. ,1987-02-26
Discovery Of Crude Oil Significant. ,1987-02-18
World Crude Oil Reserves. ,1987-02-09
Oil Price Falls Below $16. ,1987-02-26
Commodities ,1987-02-12
Gettysburg Times ,1987-03-03
Gettysburg Times ,1987-02-12
Has First Dog Rex Been Seeing Ghosts? ,1987-02-17
Texaco Is Hit With Billion Bill From Irs For Back Taxes. ,1988-01-14
Texaco May Owe. ,1988-01-14
Us Crude Oil Slipped 4.1 Pet. In ,1988-01-05
Deadline Extended For Farm Crude Oil Refunds. ,1988-01-13
Commodities ,1988-01-04
Saudis Said Selling Oil Below Opec Price. ,1988-01-11
Us Oil Production May Decline Further. ,1988-01-09
Uncertainty Over Oil Outlook. Big Us Price Fall Likely: ... ,1988-01-28
Deadline Pushed Back For Crude Oil Refunds. ,1988-01-08
The Vindicator ,1988-01-14
Crude Oil Futures Finish Slightly Lower'. ,1988-01-14
Ocala Star Banner Saturday. January 2.1988 Quick-Fix Budget ,1988-01-01
Another Oil Opportunity. ,1988-01-05
Bank Of America Foresees Volatile Oil Price. ,1988-01-29
The Free Lance-Star ,1988-01-19
Crude Oil Refund Deadline Extended. ,1988-01-20
"Saudi Decision To Cut Oil Prices Could Hurt Opec, Us. Industry",1988-01-18
Other Major Inland Spills. ,1988-01-05
Record-Journal ,1988-01-19
Alaska May Have Passed Texas In Oil Production ,1988-01-14
Alaska May Have Passed Texas In Oil Production ,1988-01-12
Deficit Hocus-Pocus. ,1988-01-06
Crude Oil Refund. ,1988-01-11
Deficit Hocus-Pocus. ,1988-01-03
The Great American Deficit Hocus-Pocus. ,1988-01-18
Some Deficit Hocus-Pocus. ,1988-01-04
Deficit Hocus-Pocus. ,1988-01-08
Jack Anderson.. Iran May Join Oil Curb. ,1988-01-16
Iran May Finally Cut Oil Production ,1988-01-16
Iran May Cut Back On Oil Production ,1988-01-20
"Hex, He May Not Have A Pulse, Buthe Can Still Work A Crowd. ",1988-01-16
Iranians May Cut Oil. ,1988-01-16
Iranians May Cut Back On Oil Production ,1988-01-20
Iran May Cut Back Oil Production Jack Anderson ,1988-01-16
Washington Merry-Go-Round Iranians May Finally Cut Back Oil. ,1988-01-18
Coming Around. ,1988-01-16
Farmers Oil Refund Extended. ,1988-01-08
Shocks Texaco. ,1988-01-14
Iranians May Cut Back Oil Production ,1988-01-16
Ohic Fuel-Buying Groups Are Hot Idea For Saving On High ... ,1988-01-07
Oil Spill Payout Highest Ever. ,1988-01-13
Iran May Cut Oil Productior Washington Arabia's Pd Iranian ... ,1988-01-17
Stock Prices Fall Steeply; Instability Of Market Is Cited. ,1988-01-12
Jack Anderson Iranian Cheap Oil. ,1988-01-16
Candidates Urged To Know Finances. ,1988-01-18
Crude Oil... Prices Crumble With Opec. ,1988-01-12
Commodities ,1988-01-07
Iran Eyes Cutback On Oil Production ,1988-01-17
Slash Fuel Bills. ,1988-01-06
Iran May Cut Its. ,1988-01-17
Ashland Oil Inc. ,1988-01-27
Crude Oil Futures. Slip ,1988-01-01
U-S-Oil Production Down... While Demand Up In 1987. ,1988-01-14
Joining A Fuel-Buying Group Can Work To Your Advantage. ,1988-01-08
Dr Edwin Kw Assid Lias Opened His Office At 2867 Washington ,1988-01-27
"Slower Growth, But No Recession ",1988-01-10
Irs Says Texaco May Owe $6 5 Billion In Back Taxes. ,1988-01-14
Weak Prices Of Oil Push Usx Into Red. ,1988-01-27
For First Time Since Prices Plunged. Major New Oil ... ,1988-01-18
"Amoco Owes $85 Million For Oil Spill, Judge Rules. ",1988-01-12
Gainesville Sun ,1988-01-14
Texaco ,1988-01-14
Deficit Hocus-Pocus. ,1988-01-07
Robert Walters... Deficit Hocus-Pocus. ,1988-01-08
Texaco Inc. May Owe $65 Million In Taxes. ,1988-01-14
Commodity Roundup. ,1988-01-13
Texaco Gets Tab On Billion In Overdue Taxes. ,1988-01-14
Irs: Texaco Owes Hillior ,1988-01-14
Oil Prices Slightly Lower; Stocks Fall Back. ,1988-01-13
Hands Billion Tax Bill To To Financially-Troubled Texaco. ,1988-01-14
"Pa Oil Spill Not Unusual, Epa Says. ",1988-01-06
Oil Prices Are Lower; Stocks Fall. ,1988-01-13
Irs Seeks Billion In Back Taxes From Troubled Texaco. ,1988-01-15
Report Pushes Oil Price Down. ,1988-01-12
Humphrey Criticizes Bush For Role In Oil Price Increase. ,1988-01-19
Weekly Round-Up. ,1988-01-18
Iranians May Finally Cut Back Oil Production ,1988-01-18
Prudhoe Oil Polluting Tundra? Groups Protest Further As ... ,1988-01-21
Long Range Outlook Said Good Bellevue Air Tested. ,1988-01-08
Leader To Meet Reagan Environmental Groups Claim Tundra ,1988-01-21
Texaco To Billion Loss For 87. ,1988-01-28
Commodities ,1988-01-27
By Feds And State. Shell Application To Be Checked. ,1988-01-15
Jack Anderson ,1988-01-16
Oil Spill Should Have Surprisingly Light Impact. ,1988-01-08
Moscow-Pullman Daily News ,1988-01-12
"Jm Petroleum Corp, Is Now Accepting Applications For Crude ",1988-01-20
Oil Prices Drop; Stocks Fall Amid Anxiety. ,1988-01-13
Oil Prices Are Nearing $18 Mark. ,1988-01-06
January Gas Prices Lowest Since 1980. ,1988-01-29
Commodities ,1988-01-08
Cheaper Crude Oil Blends. ,1988-01-19
87 Wholesale Prices. Show Modest Gain ,1988-01-15
Jack Anderson ,1988-01-16
Exxon Gain ,1988-01-27
"Drilling Of Oil, Natural Gas Wells In Us. Expected To Rise By ",1988-01-30
Oil Well Drilling To Increase. ,1988-01-30
Oil Prices Slip Lower. ,1988-01-01
Sun Refinery Hit By Smoky Blaze. ,1988-01-08
Manila Standard ,1988-01-21
Ill ,1988-01-13
Keating; Lifts Limit On Foreign Oil And Gas Investment. ,1988-01-21
Exxon Posts Earnings Gain ,1988-01-26
"Business Capsules. Oil, Gas Production Remains Stable. ",1988-01-06
More Opec Uncertainty Drops Price. ,1988-01-13
The Indian Express ,1988-01-05
Iraq Claims Ship Attack; Two Die In An Earlier Raid. ,1988-01-29
Usx Reports 87 Profits From All Units. ,1988-01-27
Practical Pointers For You To Help Maintain Your Car. ,1988-01-29
Wholesale Prices Down Last Month. ,1988-01-16
Public Notice Spotsylvania County. ,1988-04-27
Speculation On Opec Action Spurs Rise In Crude Oil Prices. ,1988-04-11
Crude Oil Production Expected To Rise In 90s. ,1988-04-18
"1987 Production Of Gas Increases, Crude Oil Declines. ",1988-04-05
Man Attempts To Catch. Bird Covered With Crude Oil Volunteer ,1988-04-26
"Energy Forecast. Domestic Oil Production, Natural Gas Demand ",1988-04-18
Oil Companies Report Huge Profits. ,1988-04-26
Oil Prices Surge On Persian Gulf Tensions. ,1988-04-19
"1 75,000 Gallons Of Gooey Crude. Oil Spill Menaces Sanctuary",1988-05-01
Opec Plan To Curb Output Fuels Oil Prices Leap. ,1988-04-12
Oil Prices Jump As Opec Speculation Incites Action ,1988-04-12
Brower.. Opec Scheming Should Not Be Taken Lightly. ,1988-04-28
"Kansas Tax Drives Oil Firms Out, Workers Say. ",1988-04-14
"Australia Faces Huge Oil Trade Deficit, Warns Apea. ",1988-04-07
Lakeland Ledger ,1988-04-03
India's Oil Output Up Marginally. ,1988-04-07
The Oil And ,1988-05-01
Prices Crude Oil Are Slightly Prices Higher Are Slightly ... ,1988-04-07
Indons Cutting Prices: Mees. ,1988-04-06
Nation Natural Gas Demand Predicted To Rise. ,1988-04-18
Byrd Puts Brakes On Bill. Vote On Trade Measure Postponed. ,1988-04-26
Byrd Puts Brakes On Bill. Vote On Trade Measure Postponed. ,1988-04-27
Oil Prices Surge On Gulf Tensions. ,1988-04-19
Refund Deadline June 30. ,1988-04-21
'Someone Nas Got Me... ,1988-04-27
"Metal Futures Rise, Oil Futures Fall As Opec Meets. ",1988-04-28
"Steel Coming Back, Use Head. Head Ifs... We're Putting... ... ",1988-04-27
The Lewiston Daily Sun ,1988-04-18
Energy Exports Will Earn $60b By 2000: Minister. ,1988-04-29
Uil Spill Turns Into A Major Menace For California Wildlife. ,1988-05-01
Volunteers Mop Up Oil In Nature Habitat. ,1988-04-26
Oil Menaces Fishing And Bird Nesting. ,1988-05-01
Oil Rrces Surge Un Persian Gun Tension Hi. I In ,1988-04-19
The Now Victoria. It As 77901. Monda April. Higher Crude Oil ,1988-04-18
Opec Talks Fail To Reach Accord On Production Cuts. ,1988-04-29
Demos ,1988-04-26
Shell Blames A Policy Violation For Big Refinery Spill Off ... ,1988-04-29
"Oil Spill In California Menaces Birds, Fish. ",1988-05-01
West Durns Mure More Of Opec's Higher Output. ,1988-04-14
Business.. Demos Seek Veto-Proof Trade Bill. ,1988-04-27
Policy Said Broken. ,1988-04-28
Trade Bill May Eliminate Windfall Profit Tax. ,1988-04-11
Weather Hampers Oil Cleanup. Slick May Be Larger Than First ,1988-04-29
"Ida Thee Robesonian, Lumberton, N. 4 Killed In Explosion On ",1988-04-13
"Oil Spill Menaces Wildlife Sanctuary, Fishing. ",1988-05-01
200 Animals Said Killed By Oil Spill. ,1988-05-01
Oil Spill Threatens Wildlife. ,1988-05-01
Oil Spill Threatens Fragile Bird Habitat. ,1988-05-01
"Massive Calif, Oil Spill Endangers Wildlife. ",1988-05-01
Opec Members Tentatively Agree To Production Cuts. ,1988-04-30
Opec Move Expected; Oil Prices Jump Higher. ,1988-04-12
8 Nations Agree To Cut Oil Output. ,1988-04-30
Oil Speculation Boosts Pound. ,1988-04-13
Opec Output Rises In March'. ,1988-04-14
Caltex Being Denied Free-Market Bas Oil. ,1988-04-28
Shell: Illegal Practice Resulted In Oil Spill. ,1988-04-28
Opec Divided Over Plan ,1988-04-29
Oil Prices Go Higher On Rumors Of Output Limits. ,1988-04-12
Shell Admits Wrong In Bird Refuge Oil Spill. ,1988-04-29
Spill Threatens Wildlife Haven. ,1988-04-26
Shell Admits Illegal Drainage Caused Huge Oil Spill Disaster. ,1988-04-29
Shell Blames Open Valve In Crude Oil Spill But The Firm ... ,1988-04-29
Schenectady Gazette ,1988-04-07
Speculation On Opec Gives Oil Prices A Jolt. ,1988-04-12
If Prices Retreat As Tensions Abate. ,1988-04-19
4a Sunday Star-News. Oil Spill. Killing Wildlife. ,1988-05-01
Shell Admits Illegal Practice Led To Oil Spill. ,1988-04-29
Opec Rumors Fuel Jump In Oil Prices. ,1988-04-12
Due Low. ,1988-05-01
Oil Cartel Talks Bog Down. ,1988-04-30
Woos Rivals; Prices Soar. ,1988-04-12
Unocal Plant Involved... Oil Tanks Blaze Extinguished. ,1988-04-06
The Victoria Advocate ,1988-04-30
Cleanup Of Oil Spill Under Way. ,1988-04-26
"Oil Production Will Be Higi In In 1990s, Forecast Says. ",1988-04-18
Bpill Termed Menace. ,1988-05-01
Spill Threatens Wildlife Sanctuary. ,1988-05-01
Massive Spill Menaces Mofford Disclosure Wildlife Sanctuary ,1988-05-01
"The Blade: Toledo, Ohio, Sunday, May 1.1988 Sec Page If. ... ",1988-05-01
Crude Oil Passes $18-A-Barrel Mark. ,1988-04-13
Opec Meet May Look At Sagging Oil Prices. ,1988-04-09
Senate ,1988-04-26
Bean Buying Binge. ,1988-05-01
Energy Demand Seen Increasing. ,1988-04-18
Commodity Roundup. ,1988-04-16
Precious Metals Futures Rise. ,1988-04-28
"Business Opec Members Face Another Crisis, But Higher Oil ",1988-04-24
Boy's Worst Since 1971. Sf Oil Spill Killing Wildlife. ,1988-04-28
"Opec May Be Losing Battle, Again ",1988-04-24
Prices Fall; Opec To Meet. ,1988-04-09
Opec ,1988-04-29
Apea Seeks. Exdloration Tax Relief. ,1988-04-07
Transition To The Gas Era. ,1988-04-04
Oil Spill Cleanup Goes On ,1988-05-01
Oil Prices Mixed In ,1988-04-01
Pizza Hurt. ,1988-04-07
"Gulf Crisis Spurs Gold Stocks, But Industrials Down. ",1988-04-20
Texaco Tries To Shed Musty Corporate Image. ,1988-04-03
Cory To Ask. Unlad Against Radical Land Bill. China For ... ,1988-04-11
Id Rx On Daily. New! Om April 5 1988. Panel Hears Plan To ,1988-04-05
Damaged Oil Tanker Stays Off Galveston ,1988-04-11
Make Your Home Our Home 212 Sam Houston Continkntal ... ,1988-04-15
Oil Tanker Explodes. ,1988-04-13
Oil Tanker Explodes. ,1988-04-12
Drop In Oil Prices Slows Eor Projects. ,1988-04-20
"Interior Secretary Hodel: In Middle Of Controversy, He's ... ",1988-04-21
Opec May Cut Output Slightly Kaiser Contract. ,1988-04-30
New Cars Becoming More And More High-Tech. ,1988-04-15
Menaces Wildlife. Miles To Voluntarily Help State Crews ... ,1988-05-01
Georges Bank Drilling Plan Spurs Debate. ,1988-04-01
Business Oil Expert Cautions That Shortages Are Not Entirely ,1988-05-18
Oil Prices Decline As Opec Rejects Cut. ,1988-05-03
Oil Traders Looking For Clues. ,1988-05-28
Tesoro Sells Firm Parts. ,1988-05-12
Tesoro Sells Firm Parts. ,1988-05-13
"1 75,000 Gallons Of Gooey Crude. Oil Spill Menaces Sanctuary",1988-05-01
News Digest. Indonesia Supplies More Oil. ,1988-05-25
Oil Prices Tumble But Not To Levels Preceding Opec's Meeting,1988-05-02
Oil Firms Profits Rise. ,1988-05-22
Irea Gas Prices. I. St Cents. Ill In Two Weeks For Il Ir. ... ,1988-05-03
Warning ,1988-05-31
The Oil And ,1988-05-01
The Vindicator ,1988-05-27
Court To Hear Oil Company Case. ,1988-05-16
"Battered By Regulations, Prices. ",1988-05-15
Uil Spill Turns Into A Major Menace For California Wildlife. ,1988-05-01
Oil Prices Stabilise On World Markets. ,1988-05-05
Oil Menaces Fishing And Bird Nesting. ,1988-05-01
Gas Gives Ailing Southwest Economic Hope. By Howard.... ,1988-05-22
"Oil Spill In California Menaces Birds, Fish. ",1988-05-01
China's Largest Oil Field To Run At A Loss. ,1988-05-24
'88 Looking Up For Depressed Oil States. Luvv Prices Sink. ... ,1988-05-31
"Oil Spill Menaces Wildlife Sanctuary, Fishing. ",1988-05-01
200 Animals Said Killed By Oil Spill. ,1988-05-01
Oil Spill Threatens Wildlife. ,1988-05-01
Oil Spill Threatens Fragile Bird Habitat. ,1988-05-01
"Massive Calif, Oil Spill Endangers Wildlife. ",1988-05-01
House Building Dips. ,1988-05-19
Crude Oil Imports Rise 24.1 Percent. ,1988-05-19
Expert Predicts Rive Rears To To Return Marsh. I-Iitr ,1988-05-02
Oil Prices Drop As Opec Alliance Bid Fails. Key Us. Crude ... ,1988-05-02
Missing Men Being Sought. ,1988-05-07
Missing Men Being Sought. ,1988-05-07
Oil Prices Continue Mixed. ,1988-05-09
Oil Prices Continue Mixed. ,1988-05-11
Crude Oil. Nrice Slides Higher. ,1988-05-10
World Oil Prices Stabilizing. ,1988-05-04
Three More Bodies Found In Burned Refinery Ruins. ,1988-05-07
3roup Demands Tor Oil Leak Damage. ,1988-05-03
4a Sunday Star-News. Oil Spill. Killing Wildlife. ,1988-05-01
Due Low. ,1988-05-01
The Lewiston Daily Sun ,1988-05-07
Commodities ,1988-05-19
Bpill Termed Menace. ,1988-05-01
Spill Threatens Wildlife Sanctuary. ,1988-05-01
Massive Spill Menaces Mofford Disclosure Wildlife Sanctuary ,1988-05-01
"The Blade: Toledo, Ohio, Sunday, May 1.1988 Sec Page If. ... ",1988-05-01
Pennsylvania Oil Well Operators Balking At Environmental Rules,1988-05-11
Bean Buying Binge. ,1988-05-01
Slick Job. ,1988-05-03
Oil Imports Up. ,1988-05-19
Must Discourage Use Of Oil. ,1988-05-07
International S. Africa Strikes Oil In Mossel Bay. ,1988-05-10
Saudis Welcome Collapse Of Talks On Oil Cutbacks. ,1988-05-02
"Suit Against Blaine Twp, Is Dropped Officials Did Not ... ",1988-05-06
"Localstate Obituaries, 3bmoney, 4b. Spill Fuels Drilling Debate",1988-05-09
Oil Prices Slide On Us. Buildup ,1988-05-19
Saudis Pleased With Collapse Of Oil Production Cutback Talks,1988-05-02
Opec's Failure To Reach Agreement Causes Swift Plunge In ... ,1988-05-02
Oil Prices Plummet. ,1988-05-02
Gulf ,1988-05-15
Oil Spill Cleanup Goes On ,1988-05-01
Opec In Turmoil. Oil Prices... ,1988-05-02
The Madison Courier ,1988-05-02
Opec Fails To Agree On Export Cuts. ,1988-05-02
Oil Price Sent Into Nosedive. ,1988-05-02
Projects Enable Shell To Use More Local Crude. ,1988-05-17
Menaces Wildlife. Miles To Voluntarily Help State Crews ... ,1988-05-01
The Press-Courier ,1988-05-01
Us Imports Of Crude Oil Rose 24.1 Percent In April From ... ,1988-05-19
Alaska Wilderness. Lobby's Assault Makes No Sense. ,1988-05-28
Commodities: Weekly Review. ,1988-05-02
Commodity Roundup. ,1988-05-05
