title,date
Gas Tax Breakdown. ,1998-04-27
Area Gas Prices Expected To Stay Reasonable For Now. ,1998-04-17
News.. Dto ,1998-04-29
Falling Oil Prices Reflect Opec Cuts. ,1998-04-01
"Oil-Rich Nigeria Full Of Poverty, Despair. By Clashes. Press ... ",1998-04-20
International Development Nigeria's Petroleum Paradox: Oil ,1998-04-20
"Though They're Somewhat Alike, Bill Gates Isn't Rockefeller. ",1998-04-26
Beaver Country Times ,1998-04-30
Divided Japan Debates Merits Of Daylight-Saving Time. ,1998-04-03
Examining Unemployment Rates In Tuscaloosa County. ,1998-04-05
Fire Damages Unit At Marathon Refinery. ,1998-04-17
"Gas Prices Up, But Still Down From 97. Slight Increase Comes ",1998-04-13
The Victoria Advocate ,1998-04-14
Cheap Oil Drilling Might Create Lower Fuel Prices. ,1998-04-01
Slick Moves. ,1998-04-02
Oil Firms Face Royalty Suits. ,1998-04-29
Gasoline Prices Expected To Stay Low This Summer I. ,1998-04-09
Lewiston Morning Tribune ,1998-04-30
Southern Seaboard Plan May Wreck Environment. ,1998-04-01
Stocks Off To Fast Start In Second Quarter. ,1998-04-02
Low Gas Prices To Spur Travelers. The Washington Post. ,1998-04-09
Earnings ,1998-04-22
Opec Wants Oil Prices To Rise $3 Per Barrel. ,1998-04-10
Earth Day . ,1998-04-19
Russia Draws Up Economic Sanctions Against Latvia. ,1998-04-09
Dallas Crude Oil. ,1998-04-24
Inflation Barely Detectable In March. ,1998-04-15
Energy Prices Squelch Inflation Barely Visible Ist-Quarter ... ,1998-04-15
Inflation Stays Down; Economy Poised To Slow. ,1998-04-15
Sarasota Herald-Tribune ,1998-04-15
Lakeland Ledger ,1998-04-15
Inflation Inches Up. ,1998-04-15
Inflation Dareiy Seen In Iirsi And Inflation The Stork In ... ,1998-04-15
Cattle ,1998-04-07
Making Music. ,1998-04-15
Oil Gas Prices Rise Nearly 3 Cents. ,1998-04-13
"Cyrus Earl Webb, Ii. ",1998-04-12
Pittsburgh Post-Gazette ,1998-04-21
"Afi Tillah If. Times Saturday, May. Business O. V Japanese ... ",1998-05-01
Victoria Area Rig Count. ,1998-04-05
Commodities Money. ,1998-04-18
Dropping Energy Prices Wipe Out Inflation; Growth Rate May Slow,1998-04-15
Sunflower Oil 12.69 Sunflower Others Crude. Oil Prices ... ,1998-04-16
Boca Raton News ,1998-04-15
Sunflower Oil 12.87 Sunflower Others. B360 Crude Oil Prices ,1998-04-23
Gas Prices Beat Last Year Even With Increase Of Nearly 3 Cents,1998-04-12
"Analyst Says Gas Prices Up Slightly, But Still Low. ",1998-04-13
Sunflower Oil 12.87 Sunflower Others 13.69. Crude Oil Prices ,1998-04-28
Gas Prices Up But Better Than 97. ,1998-04-13
Prices At The Gas Pump Rising But Still Lower Than Last Year,1998-04-13
Sunflower Oil Sunflower Crude Oil Prices $15.32 West Texas ,1998-04-08
Trade Deficit Reaches An All-Time High. ,1998-04-18
Gasoline Prices On Way Up. ,1998-04-27
Japan's Way To Boost Exports. ,1998-04-16
Inflation At Snail's Pace In 1st Quarter. 0.2 Percent: ... ,1998-04-15
Inflation Hardly Blip On Radar. ,1998-04-15
Stronger Baht Cuts Export Value. ,1998-04-11
Gas Prices Increase About 3 Cents. ,1998-04-13
Sunflower Oil 12.52 Sunflower Others 12.69. Crude Oil Prices ,1998-04-03
Gas Prices Up; But Still A Deal. ,1998-04-12
Gas Prices Beat Last Year. ,1998-04-13
Earth Day Has Become Obsolete. ,1998-04-16
Gas Prices On The Rise After Honeymoon Period. ,1998-04-27
"Despite 3-Cent Rise, Gas Lower Than Last Year. ",1998-04-14
121 Billion ,1998-04-17
Markets Stocks Fall Sharply Over Renewed Asia Concern. ,1998-04-16
Ranchers Request Study Before Pipeline Is Built. ,1998-04-23
Corrections Corp. Of America. Private Prison Operator Sold. ,1998-04-21
The Argus-Press ,1998-04-26
Boj Says Japan's Outlook Remains Bleak. ,1998-04-14
Tassauited ,1998-04-02
Refinery Woes Raise The Price At. Gas Pumps. ,1998-04-30
Liff Commodities Money Rates. ,1998-04-23
New Straits Times ,1998-04-14
"Lottery Results: Wednesday, April 29 Lotto 3-4-7-40-44-So ... ",1998-04-30
"Business 30 Vs, Japanese. Connex Cnmri 500. Industrial Yen. ",1998-04-03
Aft The Gadsden. Times Sat! Pay. April Is. Business Briefly. ... ,1998-04-18
Beaver Country Times ,1998-04-26
The Argus-Press ,1998-04-01
Key Indicators. ,1998-04-01
No Coupons Necessary. ,1998-04-22
Fine Truck Fira. Lille Driver. ,1998-04-16
National Ews In Brief. ,1998-04-16
Ellen Degeneres If Sitcom Denied Renewal By Abc. ,1998-04-24
Victoria Area Rig Count. ,1998-04-12
Truck Lire Kills Driver. ,1998-04-15
First Maryland's Net Million ,1998-04-22
Lunch Dinner. Coupon Must Be Used By Two Adults Dine-In Only ,1998-04-04
Constuction Worker Killed In Accident. ,1998-04-23
Summit Baggage. Plenty Of Hard Luck Stories Among World Leaden,1998-04-15
Investment Banker: Koch Industries Gave Negative Impression ,1998-04-29
Stock Market Roaring Again ,1998-04-02
Tanker Driver Had Three Dui Arrests. ,1998-04-17
Rat Commodities ,1998-04-27
Victoria Area Rig Count. ,1998-04-19
Gas Truck Explodes. ,1998-04-16
Lawrence Journal-World ,1998-04-20
Koch Brother Denies Ceo Ouster Attempt. ,1998-04-21
"Gas Truck Blast Kills Man, Imperils Refinery. ",1998-04-16
Key Indicators. ,1998-04-25
I. Key Indicators. ,1998-04-15
Finances ,1998-04-21
Rates ,1998-04-30
Monthly Fuel Survey Shows Continued Bargain At The Pump. ,1998-05-06
Gushing Oil Tanks Reflect Market Woes. ,1998-05-24
Low Prices Hurting Crude Oil Producers. ,1998-05-30
Drivers Enjoying Low Gas Prices. ,1998-05-26
Producers Are In Crunch On Oil Prices. ,1998-05-29
"Gas Prices At Four-Year Low, Off 20.7 Cents In Six Months. ",1998-05-21
"New Russian Cabinet Meets, Cuts Crude Oil Tax Despite Imf. ",1998-05-08
Commodities Money. ,1998-05-02
Crude Soars On Rumors Or Runner Production Cuts. ,1998-05-03
"Oil, Gasoline Prices Climb . ",1998-05-23
Monthly Fuel Supply Shows Continued Bargains At The Gas Pump,1998-07-01
Survey Shows Continued Bargain ,1998-06-10
Oil Outlook. Producers Drown In Gas. Oversupply Of 01. ... ,1998-06-10
Opec May Cut World Oil Supply; Crude Rises . ,1998-06-24
Opec Agrees To Slash Daily Oil Production ,1998-06-25
Opec Ministers Cut Output To Raise Prices. ,1998-06-25
"Crude Oil Futures Reverse Gains, Tumble To Low. ",1998-06-13
Oil Glut Expected To Continue. ,1998-06-10
"Oil Supplies Remain High, Prices Low. ",1998-06-10
Crude Futures Retreat. ,1998-06-26
Opec Ministers May Cut Production ,1998-06-28
No Joy For Producers As Opec Seeks More Oil Supply Reductions,1998-06-10
Oil Opec Presses To Trim Market. ,1998-06-24
"Forget Rhetoric, Offshore Oil Drilling Looms. ",1998-06-24
Opec Seeks More Supply Reductions. Cuts Called As Market Slides,1998-06-10
Opec Ministers Seek Bigger Cuts. ,1998-06-22
California To See New Offshore Drilling Rigs. ,1998-06-24
"Oil Prices Drop, Yet Opec Seeks More Cuts. ",1998-06-10
No Joy For Oil Producers As Opec Seeks Cuts. ,1998-06-10
New Offshore Drilling In Pipeline. Oil: Plans Are Under Way ... ,1998-06-24
The Argus-Press ,1998-06-12
Crude Continues Slide. ,1998-06-19
Announced Oil-Production Cuts Boost Us. Stock ,1998-06-05
World And Nation Thursday June. 25 1998 Page. Opec Seeks To ,1998-06-25
Abundance Of Crude Oil Pushes Gas Prices Down. ,1998-06-15
Gas Prices Pushed Down By Oversupply Of Crude Oil. ,1998-06-15
Opec To Discuss Production Cuts In Vienna. ,1998-06-21
Traders Seeking More News On Petroleum. ,1998-06-04
"Technology, Energy Stocks Give Dow Jones A Boost. ",1998-06-24
New Oil Reservoirs Discovered. ,1998-06-26
Opec Plans Cuts In Oil Production ,1998-06-22
Opec Cuts Production In Search Of Higher Prices. ,1998-06-24
Opec Seeks To Boost Its Oil Prices. By Dirk. Beveridge ,1998-06-25
New Sunday Times ,1998-06-10
By Cliff Edwards. ,1998-06-26
Oil ,1998-06-09
Tainted Beach Slated For $18 Million Clean Up. ,1998-06-19
Clinton Extends Coastal Oil Ban ,1998-06-13
Stocks Rise Though Earnings Doom Looms. ,1998-06-05
Petronas Eyes Shell Thailand Upstream Assets. ,1998-06-17
Bonds Edge. Low ,1998-06-10
Nation A Columbiahca. ,1998-06-19
Jgcin Venezuela Oil Plant Deal. ,1998-06-16
Tied Market. ,1998-06-24
2 Newly Found Tribes Speak In Sign. ,1998-06-23
Lodi News-Sentinel ,1998-06-12
Gasoline Prices Drop. ,1998-06-15
Try Again To Cut Output. ,1998-06-23
"Vienna, Austria. Bigger Oil Cuts Urged. ",1998-06-24
The Argus-Press ,1998-06-24
Commodities ,1998-06-07
Gas Prices Down Nearly 3 Cents. ,1998-06-15
Gas Prices Down Nearly 3 Cents. ,1998-06-15
Gas Prices Down Slightly. ,1998-06-15
D8 National. Gasoline Prices Down 3 Cents A Gallon ,1998-06-16
"Change In State Sales Tax Collections, 1988 1997. V. ",1998-06-12
Commodities ,1998-06-10
Gas Prices Down Nearly 3 Cents In Past Two Weeks. ,1998-06-15
Foreign Investment In United States Falling. ,1998-06-11
Gasoline Prices At Lowest Pre-July 4th Levels In Years. ,1998-06-28
Commodities Money. ,1998-06-19
Federal Mediators May Declare Impasse At Northwest Talks. ,1998-06-10
The Nation ,1998-06-28
By Cliff Edwards. ,1998-06-11
Stocks Climb On News Of Efforts To Boost Yen. ,1998-06-18
Petronas Does Not Intend To Reduce Oil Production ,1998-06-30
Reduce Oil Markets. ,1998-06-22
Commodities ,1998-06-17
"Fears, Worries Threaten Prices Of Commodities. ",1998-06-04
Leaders Weigh Slashing Oil Output More. Oil Prices Have Been ,1998-06-23
Falling Bant Causes Petrol Prices To Rise. ,1998-06-11
Commodities ,1998-06-13
Oil Rates Looking Gloomy. ,1998-06-10
California ,1998-06-19
John Nassikas... Head Of Federal Power Commission ,1998-06-16
Amazing Prices. ,1998-06-21
"Gas Prices Are Slow To Drop, Quick To Go Up. ",1998-06-17
"Sell Republic, And Buy Teekay. ",1998-06-29
"Computer Stocks, Oil Shares Climb; Dow Average Slips. ",1998-06-23
Brent Oil Price Jumps In Technical Rebound. ,1998-06-17
Computer-Related Stocks Give Nasdaq A Needed Shot In Arm. By ,1998-06-23
Fuel: Utility May Appeal Decision Denying Orimulsion As Fuel. ,1998-06-25
Tugboat Collision Spills Oil Into Mississippi. ,1998-06-28
Mclouth Juror Says Koch Trial Boggles Mind. ,1998-06-24
Wall Street Flocks To High-Tech Stocks Oil Shares Also Gain ,1998-06-24
National Survey. Gas Prices Fall Amid Sea Of Crude. ,1998-06-15
Stock Market. ,1998-06-13
Good Growing Conditions Could Damp Grain Prices. ,1998-06-07
Unemployment Rates. ,1998-06-26
July 4th Gas Prices Down 14 Cents From. Lowest Since 4th Of ,1998-07-01
Competition Takes Gas Prices Lower. ,1998-06-29
Nonferrous Metals. ,1998-06-16
Report Was Wrong; Gas Prices Went Up. ,1998-06-16
Malaria Cure. ,1998-06-19
Opec Cuts. ,1998-06-22
Chicago Eggs. ,1998-06-30
Competition Pushes Summer Gas Prices Down. ,1998-06-29
Sunflower Oil. 1227 Sunflower Other 1369 Crude. Oil Prices ... ,1998-06-01
Stocks Mostly Lower At Noon ,1998-06-02
Gas Prices Rose A Third Of A Cent During Past Two Weeks. ,1998-06-16
Competition Keeps Gasoline Prices Down. ,1998-06-29
Mccook Grain Market. ,1998-06-11
Gas Prices Hit Summer Low. ,1998-06-29
Mccook Grain Market. ,1998-06-26
The Argus-Press ,1998-06-09
Wheat Showing Effects Of No Rain ,1998-06-04
The Deseret News ,1998-06-16
Mccook Grain Market. ,1998-06-08
Summer Gas Prices Drop. ,1998-06-30
Newmd Says Compaq Will Rise Again ,1998-06-30
Monthly Fuel Supply Shows Continued Bargains At The Gas Pump,1998-07-01
Petronas Expects Tough Year Due To Lower Prices. ,1998-07-08
Oil Prices Fall For Second Session ,1998-07-07
Joe Equity Choice! ,1998-07-16
Plans Under Way For New Offshore Drilling Along Calif. ,1998-07-15
Commodities Money. ,1998-07-15
Preliminaries Under Way For Oil Wells Off California. ,1998-07-15
Crude Oil Glut Keeps Prices Down. ,1998-07-13
Offshore Drilling Planned. ,1998-07-14
Daily News ,1998-07-09
Monsanto Alters Marketing Plans. ,1998-07-07
Gadsden Times ,1998-07-09
Reading Eagle ,1998-07-12
Surry Street Site On Superfund. Epa's Refinery Cleanup Is ... ,1998-07-26
Toledo Blade ,1998-07-02
Oil Prices Fall Further. ,1998-07-21
Oil Prices Rise In Quiet Trading. ,1998-07-14
Summer Gas Prices Holding Steady. ,1998-07-12
Eugene Register-Guard ,1998-07-25
Daily: Exploration Firm Japan Oil To Be Saved. ,1998-07-30
Crude Oil Futures Fail To Retain Gains. ,1998-09-12
Heating Oil Glut Cuts Price. Many Customers Stocking Up Un ,1998-09-04
Oil Imports Up. ,1998-09-10
In Brief. Summer Travel Season Ends. Kw I. Nyse With Record ,1998-09-04
Summer Travel Season End: With Record Low Gas Prices. ,1998-09-05
Crude Oil Prices. ,1998-09-16
Warning ,1998-09-22
Warning ,1998-09-22
Crude Oil Falls Over High Supply Concerns. ,1998-09-09
Lawrence Journal-World ,1998-09-23
Lower Prices To Come. ,1998-09-05
Crude Oil Jumps On Export Delay. ,1998-09-05
Gas Prices Up About A Penny. ,1998-09-22
Continued From Page. 1. ,1998-09-04
Weather Forecast Boosts Natural Gas Futures. ,1998-09-05
The Argus-Press ,1998-09-26
Prices Rise Slightly; Trade Gap In Check. ,1998-09-18
Analyst Says Gasoline Prices Are In Depression'. ,1998-09-14
Gas Prices Are Still Dropping. ,1998-09-14
Says Gasoline. ,1998-09-13
Analyst Says Gasoline Prices Are In Depression ,1998-09-14
Fill Er Up: Fuel Prices Plunge More. ,1998-09-14
Iras Prices In Ny. Hit 9-Year Low. ,1998-09-04
Natural Gas Producers Watching Prices Fall. ,1998-09-03
Beaver Country Times ,1998-09-14
Gas Prices Are Down. ,1998-09-13
San Francisco. Oil Spill Kills Birds Off Pacific Coast. ,1998-10-01
Pittsburgh Post-Gazette ,1998-10-01
Big Cleanup For Beach Town. ,1998-09-09
Severance Tax Break. Should Other Businesses That Are ... ,1998-09-01
Crude Oil Spill Killing Birds Off The San Francisco Coast By ... ,1998-10-01
Gasoline Prices In Depression'. ,1998-09-14
"Nationworld Gas Prices Depressed, Analyst Says. ",1998-09-14
Commodities Money. ,1998-09-26
Oil Spill Threatens Birds. ,1998-10-01
Paper Says Oil Summit Ahead. ,1998-09-23
Children Learn Safety Essential When Using Farm Equipment,1998-09-23
Markets Not All Bad News: Late Bounce Halves Latest ... ,1998-09-04
"Layoffs, Budget Cuts At Arco. ",1998-09-26
California More Birds Die From Crude Oil Spill. ,1998-10-01
Auuui Lull. ,1998-09-27
Koch Industries Disputes Federal Findings As Untrue. ,1998-09-02
"Natural Gas, Crude Retreat. ",1998-09-26
Oil Industry Waits For Prices To Bounce Back. ,1998-09-11
Observer-Reporter ,1998-09-29
Nation ,1998-09-09
Heating Costs Fall. ,1998-09-14
Oil Firm Reports... ,1998-09-17
Pipeline Company Alleges Conspiracy. ,1998-09-03
Business Briefing. ,1998-09-04
Earnings Jitters Spark New Sell-Off. Wall How Economic. Noil ,1998-09-23
Economy ,1998-09-18
The Durant Daily Democrat ,1998-09-20
The Tuscaloosa News ,1998-09-06
Gas Prices Lowest In More Than Six Years. ,1998-09-23
Proposition 65 Warning. ,1998-09-30
Eugene Register-Guard ,1998-09-21
Daily Limes. Cheaper Gasoline Likely To Keep Flowing For Awhile,1998-09-14
Briefs Senate Panel Oks First Bill To Protect Internet Privacy. ,1998-10-01
Interest Rates Fall. ,1998-09-28
Key Indicators. ,1998-09-29
Gas Prices Reach Lowest Levels In 61/2 Year. ,1998-09-23
Key Indicators. ,1998-09-05
Gas Prices Hit New Low. ,1998-09-23
The Deseret News ,1998-09-10
Price At The Pumps Lowest Since 1992. ,1998-09-23
Gas Prices Continue To Fall. ,1998-09-14
Orange Juice Futures Tumble 4 Percent. ,1998-09-11
Key Indicators. ,1998-10-01
Rig Count. ,1998-09-06
Key Indicators ,1998-09-16
Gasoline Prices Lowest In Six Years. ,1998-09-23
Rates Foreign Metalsforeign Index. ,1998-09-22
The Tuscaloosa News ,1998-09-12
Nation's Economy Continues To Look Positive. ,1998-09-18
Briefing New York. Gas Prices Hit Year Low. ,1998-09-23
Gas Prices Are Lowest In 6 1/2 Years. ,1998-09-23
Analyst Says Gas Prices In Depression'. ,1998-09-13
Key Indicators. ,1998-09-15
Price Of Gasoline Reaches Lowest Level In Years. ,1998-09-23
The Tuscaloosa News ,1998-09-21
The Victoria Advocate ,1998-09-20
Gas Prices Reach Lowest Level In 6 1/2 Years. ,1998-09-23
Briefly Markets ,1998-09-11
Finance ,1998-09-09
Analyst Says Gasoline Prices In Depression'. ,1998-09-14
Rates ,1998-09-28
Karate Facts. ,1998-09-14
"Pump Prices Jump By Penny Per Gallon, Reversing Trend. ",1998-09-28
Gasoline Depression ,1998-09-15
"Page Aid Saturday, September. Airline Workers Seeking ... ",1998-09-05
"Gas Prices Reach Lowest Levels In More Than 6 Years, Am Says",1998-09-23
Key Inuiuaiuhb ,1998-09-02
Pump Prices Plummeting. ,1998-09-23
Pump Prices Jump By Penny Per Gallon Yearlong Trend. Line ,1998-09-28
Price At The Pumps Lowest Since 1992. ,1998-09-23
Key Indicators. ,1998-09-23
Gas Pnces In Depression? ,1998-09-14
Briefly Markets ,1998-09-25
Rates ,1998-09-30
Till Tamshen Times Friday. September T. Business 30. Vs ... ,1998-09-04
Key Indicators. ,1998-09-26
"Nasdaq Hits Record, Blue-Chips Fall Back. ",1998-09-11
Rates Foreign Exchange. ,1998-09-24
Waycross Journal-Herald ,1998-09-14
'Group Of Seven Calls The Tune In Troubled Russia. ,1998-09-14
Gritty Times For Beach Town. Locals Fear Oil Cleanup Will ... ,1998-09-04
"Markets Dow Gains 80, But Broad Market Struggles Before Fed ",1998-09-29
Ommodity Rod. ,1998-09-03
32pc Drop Seen In Oil Export Revenue Of Opec Nations. ,1998-09-10
Heating Oil Prices Stabilize. The Planning Office And Oil. ... ,1998-10-21
"Weak Crude, Gas Prices Drop Big Oils9 Earnings. ",1998-10-22
Crude Oil Tanker Spill Kills Wildlife. ,1998-10-02
"Home Heating On Prices Iuw For Now. Crisis Definitions, And ",1998-10-21
Wheat Soars On Australian Cold Spell. ,1998-10-05
"Mexico Extends Crude Oil Cuts Through June, 1999. ",1998-10-03
Pump Prices Decline. ,1998-10-27
Oil Spill Source Being Tracked. Satellite Photos May Help ... ,1998-10-02
Investigators Try To Track Spill's Source. ,1998-10-02
Gas Price Investigation Yieias No Violations. Sloven Oil. ... ,1998-10-07
Gas War. ,1999-01-14
Inventories Keep Fuel Prices Low. ,1999-01-10
Strong Rally Of Crude Oil Futures Prices Continues. ,1999-01-08
Gas Reading. ,1999-01-20
Kansas Oil Producers May Get Saving Tax Break. ,1999-01-21
Observer-Reporter ,1999-01-12
Observer-Reporter ,1999-01-12
The Argus-Press ,1999-01-21
Local Gasoline Prices Low. Northwest Georgians Paying Less ,1999-01-17
"2112 W. 29th Terrace Lawrence, Kansas 66046. ",1999-01-28
"Candidates Trickle In, File For Spring Races. ",1999-01-20
The Argus-Press ,1999-01-22
Global Glut. ,1999-01-17
Torn Modify. Kip ,1999-01-15
"Exxon 4th-Quarter Profit Seen Down On Lower Oil, Fuel ... ",1999-01-21
Commodities ,1999-01-05
2c-The Victoria Advocate. Sunday January 10.19st Low Oil ... ,1999-01-07
New York. Crude Oil Prices Fall As Weather Improves. ,1999-01-06
Energy Futures Prices Jump As Cold Blankets Nation ,1999-01-01
Oil Giants Report Losses. ,1999-01-28
Gas Prices Still Dropping Despite Crude Hikes. ,1999-01-11
Gas Prices Still Dropping Despite Crude Oil Hikes. ,1999-01-11
"Soybean, Grain, Livestock Futures Up; Energy Mixed. ",1999-01-08
Texaco Takes 4th-Quarter Charge. By George. Stein ,1999-01-09
"Texaco Take 4th Quarter Charge, Miss Estimates. ",1999-01-11
Newsline ,1999-01-01
Companies ,1999-01-28
New York. ,1999-01-08
"Phillips Petroleum To Cut Jobs, Take 4th-Quarter Chaises. ",1999-01-07
"Sentate Considers Oil. Tax, Budget Cut! ",1999-01-26
Where Oil Is Plentiful But Cash Is Short. ,1999-01-17
Daily News ,1999-01-08
I. Iraq Plans To Raise Oil Production By Leon Barkho. ,1999-01-13
Oil Spill Settlement Used To Improve Beaches. ,1999-01-29
Night.. ,1999-01-21
Gas Prices Still Rolling Dropping Cbs Fight Subpoena. ,1999-01-11
Gas Prices Continue To Drop. ,1999-01-11
Fuel Supplies. Gasoline Prices Continue To Drop. ,1999-01-11
Pittsburgh Post-Gazette ,1999-01-18
Oil Slick Search Turns Up Empty. ,1999-01-22
Oil Slick Search Turns Up Empty. ,1999-01-22
"Us Petroleum Lost 29,300 Jobs In 98. ",1999-01-25
More Birds Found Coated In Oil; Source Still Unknown. ,1999-01-22
National News In Brief. Gas Prices Dropping Despite Crude Hikes,1999-01-11
Energy Prices Get. Boost From. Weather ,1999-01-05
Oil Fluctuation ,1999-01-04
Keating Calls For Special Session Jan 20. ,1999-01-06
Gas Stations: Independent Operators A Vanishing Breed. ,1999-01-13
Task Force Recommends Tax Cuts To Aid Oil Industry. ,1999-01-05
"To Cut 1,400 Jobs. ",1999-01-07
"Phillips Cutting 1,400 Jobs. ",1999-01-07
Gainesville Sun ,1999-01-07
Markets Earnings Reports Push Sir Nasdaq To Records. ,1999-01-30
Petronas Keen On Oil. ,1999-01-14
New York. ,1999-01-23
The Victoria Advocate ,1999-01-31
Price Decline Hits Hard In Tiny Oil Town. ,1999-01-22
Joui Pontiac Bonneville Se. ,1999-01-21
Cutting Costs Don't Burn Money. ,1999-01-17
The Tuscaloosa News ,1999-01-10
Stock Prices Rebound On Brazil's Foreign Exchange Strategy. ,1999-01-16
Toledo Blade ,1999-01-24
"Big Reptiles, Small Mammals, Declining Minerals. ",1999-01-21
Energy Exchanges Intensity Merger Talks. ,1999-01-21
Stroke Research. ,1999-01-30
Gas Prices Still Dropping. ,1999-01-11
Gas Prices Still Dropping. ,1999-01-11
Chevron Plunges. ,1999-01-26
Gasoline Prices At Pump Tumble. ,1999-01-11
"World Markets In Turmoil, Us. Corporations Deliver Mixed ... ",1999-01-24
Reading Eagle ,1999-01-26
Gasoline Prices Continue To Fall. ,1999-01-11
Williamson Daily News ,1999-01-24
Mixed Batch Of Earnings Point To Weaker It Areas. ,1999-01-24
Gas Prices Continue To Drop. ,1999-01-11
Southwest Implement Inc. ,1999-01-26
Mccook Groin Market. ,1999-01-25
"World Markets In Turmoil, Us. Corporations Deliver Mixed ... ",1999-01-23
Gas Prices Still Dropping I. ,1999-01-12
Stocks Rise To Record. ,1999-01-05
Earnings Reports. ,1999-01-24
Mccook Grain Market. ,1999-01-15
Explosion Relief Plan Heads To Senate. ,1999-01-21
Us Retail Gasoline Price Ends I-Week Decline. ,1999-01-13
Mccook Grain Market. ,1999-01-18
Gas Prices Still. Pi Dropping. ,1999-01-12
Stocks Making Steady Climb. ,1999-01-20
Business Briefing. ,1999-01-08
Gasoline Prices Continue To Fall. ,1999-01-11
Gas Prices Still Dropping Nationwide. ,1999-01-11
Bountiful Firm Evacuated Due To Noxious Fumes. ,1999-01-12
Stocks Rebound After Early Dip. Sioux City Livestock ... ,1999-01-13
Stocks Slump. ,1999-01-12
"Markets Stocks Give Up Big Gains To End Slightly Higher, As ",1999-01-05
Daragh Porter Named President. ,1999-01-03
Va Power Considers Fuel Of Past. ,1999-01-25
Mexican Congress Oks 1999 Spending Plan ,1999-01-01
"As T I, T Ml-M. Vim Business. To Vs. Lapanese Coma 500. ... ",1999-01-07
Edc Plant. ,1999-01-08
November Industrial Index Dips 4.7pc. ,1999-01-12
Key Indicators. ,1999-01-26
Dow Up 121. ,1999-01-27
Key Indicators. ,1999-01-12
Key Indicators. ,1999-01-21
July 1998. ,1999-01-14
The Argus-Press ,1999-01-14
Pork Futures Rally Commodities Trading. ,1999-01-12
Auto Industry. Daimlerchrysler Unveils Concept Cars. ,1999-01-04
Commodity Prices Fell To 17-Year Low. ,1999-01-02
Gadsden Times ,1999-01-30
"Relief Ahead For Oil, Gas Producers. ",1999-02-14
Producer Prices On The Rise. ,1999-02-19
To Make You Sick. ,1999-02-10
To Make You Sick. ,1999-02-10
Sun Journal ,1999-02-22
"Crude Oil Up, Glut Continues. ",1999-02-20
"Crude Oil Up, Glut Continues. ",1999-02-19
Stocks Slip 8.26 Points. ,1999-02-24
And Gas Producers. ,1999-02-05
Crude Oil Dollar Dips Against Foreign Currencies Enjoys ... ,1999-02-13
Fuel Survey Shows Price Increase. ,1999-05-12
Stocks Not Necessarily A Prudent Buy As Prices Rise. ,1999-05-12
Of Equity Oil. ,1999-05-12
The Albany Herald ,1999-05-05
"Gas Prices Dropping, But Questions About March Spike Persist",1999-05-30
Shell Doubts Oil Cuts Will... Be Maintained... Crude Oil ... ,1999-05-08
Crude Oil Prices Tumble. Shell Doubts Sb. The Major ... ,1999-05-06
Crude Oil Co Sending Gas Prices Upward. Opec Trimming Oil ,1999-05-05
"Gas Prices Drop, But Questions About Spike Persist. ",1999-05-30
Gas Prices Start Dropping As Supply Shortage Eases. April ... ,1999-05-30
"Gas Prices Drop, But Questions About Spike Persist. ",1999-05-30
Gas Prices Have Begun To Drop Girl Dies After Finding Loaded ,1999-05-30
Friendly's Creating. Distribution Center. ,1999-05-16
Daily News ,1999-05-14
Beaver Country Times ,1999-05-26
Reduction In Demand Sends Silver Futures Plunging. ,1999-05-23
Some Wonder If Drivers Were Gou. ,1999-05-29
Oil Prices Extend Gains. ,1999-05-01
Jas Prices Tailing From March Spike. By Mich. White Mt. ,1999-05-30
"World And Nation Sunday. May 1999 Page 3. Gas Prices Drop, ",1999-05-30
Gas Prices Remain Steady Over Holiday. ,1999-05-30
Gasoline ,1999-05-27
The Victoria Advocate ,1999-05-05
On The Trail Of The Great Gas Gougers. Pump Prices Appear To ,1999-05-30
"Gas Prices Dropping, But Probes Continue. ",1999-05-31
Gas Prices Are Going Up As Opec Keeps Its Word. ,1999-05-05
Report Expected To Show Opec Members Cutting Oil Production,1999-05-05
Gasoline Prices Rise As Opec Keeps Word. ,1999-05-05
Across The Nation Gas Prices Drop In Past Two Weeks. ,1999-05-24
Gas Prices Drop More Than 1 1/2 Cents. ,1999-05-25
Gas Prices Drop More Than Cents. 1. Rents Per Gallon Gallor ,1999-05-24
Gasoline Prices Finally Drop. ,1999-05-24
Gasoline Prices Down 1.5 Cents Nationally. ,1999-05-23
Gas Prices Drop 1.57 Cents Per Gallon In Past 2 Weeks. ,1999-05-24
Whatever Happened To Kittlitz's Murrelet? ,1999-05-25
Opec Keeping Its Word On Cuts. ,1999-05-05
Iraq's News Sends Oil Stocks Up. ,1999-05-22
"Gas Prices Dropping, But Questions About March Spike Persist",1999-05-31
"Gasoline Prices Drop, But Questions Persist Over March Increase",1999-05-30
"Gas Prices Drop, Questions Remain On March Hike. ",1999-05-30
Whatever Happened To Kittlitz's Murrelet? ,1999-05-21
Whatever Happened To Kittlitz's Murrelet? ,1999-05-21
Ben Wattenberg. T. Whatever Happened To Kittlitz's Murrelet?,1999-05-19
Crude Prices May Average Rm55.10 A Barrel. ,1999-05-07
Indian Air Strikes. In Kashmir Continue. ,1999-05-30
Whatever Happened To Kittlitz's Murrelet? ,1999-05-28
What Happened To Outrage Over Exxon Valdez Disaster? ,1999-05-25
Oil Output Is Really Slowing. ,1999-05-05
Opec Keeping Its Word. Gas Prices Are Slowly Going Up. ,1999-05-04
Gas Price Hike On Way; Crude Near $20 A Barrel. Gasoline ,1999-05-05
Gas Price Drop Tans To Silence Questions. By Michael White,1999-05-28
Record-Journal ,1999-05-30
Gas Price Probe Gets. ,1999-05-07
Washington ,1999-05-05
Opec Is Sticking With Cutbacks. ,1999-05-05
Opec Is Sticking With Cutbacks. ,1999-05-04
Briefly ,1999-05-05
Fuel Prices May Rise As Opec Cuts Output. ,1999-05-05
Oil Firm Expect; Flat Performanc. ,1999-05-21
