date,title
1995-11-19,Nigeria Mandela Calls For Sanctions Market Hopes Budget Battle Produces Cuts Cold Opec Jitters Up Fuel Oil Prices 
1995-11-21,Senate Ends Debate On Oil Deregulation The Dow Closes Lower Unable To Hold On To 5000 Level By 
1995-11-22,Oil Firms Demand Payment Of P4b In 
1995-11-23,Eworld Trade Opec Holds Line On Oil Production Ceiling For Now Opec Addresses Oil Glut Opec Declines To Raise Prices Claiming The Poachers Prize Stocks Reach Higher Into The Opec Addresses Oil Glut 
1995-11-24,Oil Industry Deregulation Senate To Set Limit On Price Opec Declines To Raise Prices 
1995-11-27,Chinese Oil Trader Sinochem Presses For A Bigger Role 
1995-11-28,Energy Futures Show Spurt Dow Industrials Hit Record High For Fourth Straight Session Call It As You See It Will You Go Into Debt To Buy On To 
1995-11-29,Alaskan Oil Export Ban Is Dropped 
1995-12-06,Crude Oil Spilled Into Cook Inlet 
1995-12-09,Gas Prices Bottom Out Long Decline Of Gas Prices Finally Ends 
1995-12-10,Heating Oil Leads Energy Rally As Cold Weather Boosts Demand 
1995-12-11,Gasoline Prices Bottom Out Heating Oil Leads Energy Rally 
1995-12-12,Surge In Oil Shares Trading Fuels Stocks Market Rally 
1995-12-14,Oil Stocks A Bargain Analysts 
1995-12-15,Dec Investigating Tanker NearGrounding In Alaska 
1995-12-17,Oil Stocks Are One Of The Few Bargains Left Analysts Oil Stocks Among Few Bargains Analysts Oil Stocks Among Few Bargains 
1995-12-18,Oil Deregulation Bill Ok Snagged Bicam Can Agree On Common 
1995-12-21,For the United Arab Emirates 1995 was the year
1995-12-24,Corn Futures Prices Hit 11Vear Hiahs 
1996-01-03,Passage Of Oil Deregulation Bill Delayed 
1996-01-05,P540M Bonanza For The Oil Firms Cold Exports Hike Oil Prices 
1996-01-06,Refinery News Fuels Surge In Energy Prices 
1996-01-07,Emirates Petroleum relaunched as Emarat Refinery Problems Send Energy Futures Climbing By Paul A 
1996-01-08,Refinery Problems Send Energy Futures Energy Soaring 
1996-01-10,Cabinet Men Say Oil Price Hike Inevitable 
1996-01-11,Padilla Movie Travesty Of Justice 
1996-01-12,Petroleum Stocks Expected To Stay Low Analysts Say 
1996-01-14,Oil Prices Climb After The Blizzard 
1996-01-17,Oil Futures Tumble Raqi Shipment Rumor Orces Oil Price Drou 
1996-01-18,Ignorance Of Existing Laws On Oil Still Tops But Use Drops 
1996-01-19,3 Oil Firms Making Mockery Of Deregulation 
1996-01-20,Oil Barge Sinking Off Rhode Island Crude Oil Futures Rally To Erase Most Midsession Losses 
1996-01-21,Barge Spilled Thousands Of Gallons Of Oil Officials Say 720000 Gallons Spilled From Barge Killing Crude Oil Rallies To Erase Much Loss 
1996-01-22,Barge Still Leaking Oil Fish Birds Die In Some Areas Ri Oil Spill Spreads As Cleanup Begins By Tim Whitmire Iraq May Seek Un Approval To Sell Oil Rhode Island Oil Spill Is More Serious Than Initially Thought Published 1996
1996-01-23,Kuwait tanker embezzlement case opens
1996-01-25,Residents of Kennedy Heights a predominantly black public housing
1996-01-26,Oil Futures Fall On Concern Over Iraqi Oil Sale 
1996-02-03,Record Cold In Several Regions Fuels Rise In Nations 
1996-02-04,Price Hike Rejected Industries Gang Up On Oil Trio By 
1996-02-11,Defends Exports Of Alaska Oil 
1996-02-12,Lift On Oil Export Ban Controversial 
1996-02-16,Gasoline Futures Surge Amid More Oil Refinery Shutdowns What About The Price Of Gasoline 
1996-02-17,Experts Fight To Contain Oil Spill Off Wales Slick From Oil Tanker Threatens Wildlife Havens On Coast Of 
1996-02-18,Gasoline Crude Oil Futures Surge News Of Labor Dispute 
1996-02-21,Oil tanker freed from rocks Feb 21 1996
1996-02-22,Tanker Freed After Huge Spill Wildlife Harmed By Oil Spill Lugs Tree Tanker Alter 19 Million Gallon Spil 
1996-02-23,Workers Struggle To Clean Sludge Birds After Spill 
1996-02-24,News Of Deal Delivers Blow To Oil Prices 
1996-02-25,Crude Oil Futures Collapse Chevron Preparing To Dismantle Oil Rigs Off California Oil Futures Fall After Comments On Iraq 
1996-03-04,Government GiveAway To Oil Companies 
1996-03-08,Analysts Low Oil Stockpiles Not A Concern Us Oil Supply Lowest In Years 
1996-03-11,Measures Taken To Combat Oil Spill 
1996-03-16,Crude Oil Futures Climb For Fifth Straight Session Commodity 
1996-03-17,Crude Oil Futures Rise For Fifth Straight Session 
1996-03-18,House Posts Breakthroughs On Evat And Oil Legislations 
1996-03-19,Lewiston Morning Tribunetuesday March 19 1996 
1996-03-20,New Oil Price Hike 
1996-03-21,Crude Oil Now At Its Highest Since Gulf War In Absence Of Bicam Oks Oil Deregulation Bill 
1996-03-23,Stock Prices Edge Up In Quiet Day Of Trading 
1996-03-24,Crude Oil Climbs To 
1996-03-25,Opsf Still On Even With Deregulation 
1996-03-27,Opec Finally Hits Target Oil PriceBy Accident Oil Prices Catch Up With Opec Target 
1996-03-28,Oil Deregulation 3 Other Bills Signed Into Law By Joem H 
1996-03-29,Stocks Turn A Bit Higher After Mostly Quiet Day 
1996-04-01,Refinery Process Is Pretty Slick Tiose Tones Arc Towers 
1996-04-04,Four men due in UK court for kidnapping
1996-04-06,Rising Gasoline Prices Have Holiday Motorists Grumbling 
1996-04-10,Gas Prices Hit Texans Experts Cite Various Reasons For 
1996-04-13,Oil Deregulation Tatad Asks High Court Void Ra 8180 
1996-04-14,Gramm Bill Will Ease Oil Gas Producers Fees Us Begins To See Higher Gas Demand And Prices 
1996-04-15,Investing Energy Funds Are Hot As Oil Prices Soar 
1996-04-17,Paying A Premium For Pump Prices Have Hit PreGulf War High Sr S Rumored Deal With Iraq Causes Drop In Oil Prices 
1996-04-20,Gas Prices Highest Since Gulf War Consumers Fighting Mad Nation Gas Prices At Highest Levels Since 91 
1996-04-21,Gas Price Surge Jolts California I Drivers Grumble As Gas Prices Soar Drivers Grumble As Gas Prices Soar Firivers Ers Grumble Ras Prices Gas Prices 
1996-04-23,Prices Are Rising Quickly At Local Gasoline Stations Harsh Winter Fuels Gas Price Increase But Prices Panics Ci 
1996-04-24,Technology Surge Continues While Blue Chips Lurch Higher 
1996-04-25,Air Board Holds Hearing But No Action On Gas Prices 
1996-04-26,Higher Summer Gas Prices Reach Area Early By David Patch Filling Up At The Pump Wont Leave Wallet Dry Gas Prices Soaring Prices To Peak In Early Summer 
1996-04-28,Higher Pump Prices To Fall Analysts Say 
1996-04-29,Gasoline Prices Rising And Likely To Keep Going Journal Analyst Points To Leveling Off For Us Gasoline Prices 
1996-04-30,Gas Many Factors Determine Price 
1996-05-01,Gas Companies Gamble Blamed For High Prices Energy Prices Plunge On Word Clinton Will Release Stockpiles Bad Gamble Raised Price Of Gasoline Analysts Say 
1996-05-02,Business Soaring Gas Prices Puzzle Public Briefs High Gas Prices Unfulfilled Gamble Gas Motorists Wondering Where To Place Blame Leave Gas Prices To The Market 
1996-05-03,The Ins And Outs Of Mi Higher Gas Prices Motorists Paid Price For Tight Stock Continued From I Average Gas Prices One Gallon Of Regular Unleaded 
1996-05-04,Leave Gas Prices To The Market 
1996-05-06,Charles Krauthammer Were All Shocked Shocked To See Oil Many Factors Affect Gas Prices 
1996-05-07,Present Scenario And Likely Reaction 
1996-05-08,Macaroni Line Filled A Rail Need In Texas Business Ct Pump Prices May Have Run Out Of Gas By Loren 
1996-05-09,Oil Supplies Up Prices Down 
1996-05-10,Many Factors Have Fueled The Jump In Gas Prices 
1996-05-12,Gasoline Prices Could Drop Before Washington Lowers Tax Realities Of Oil Industry Still Cheap By Historical 
1996-05-13,New Gasoline Formulas Structural Changes In Industry Cited Who Gets The Profits In Rising Gas Prices 
1996-05-15,Consumer Prices Holding The Line Fear Of Interest Rate Hike 
1996-05-19,Us Keeps Low Oil Reserve Because American Gas Inventories 
1996-05-20,Planned Oil Pipeline Is Hot Issue Utah Refiners Like Idea 
1996-05-21,Gas Prices Expected To Drop But Not Before Memorial Day Iraqi Oil Flow Could Mean Lower Prices At The Pump Impact 
1996-05-23,1 Gasoline Prices Climb 
1996-05-25,Gas Prices Not Deterring Holiday Motorists 
1996-05-28,Little Change Expected From Opec 
1996-05-30,Alaska Oil Exports To Begin 
1996-06-01,Dow Industrial Tumbles On Fears Of Interest Rate Hike 
1996-06-03,Pendulum At The Gas Pump 
1996-06-05,House Approves Oil Measure 
1996-06-06,Rising Inventory Fuels Drop In Crude Oil Price Lower Oil Prices Seen As Little Help 
1996-06-07,Opec Raises Ceiling On Oil Production Cartel Wants To Make 
1996-06-08,House Okays Modified Tax On Petrol Products 
1996-06-10,Gas Prices Fall But Not Enough To Suit Vacationers 
1996-06-11,Gas Prices On The Way Down But Profits Up 
1996-06-12,Inflation Absent As May Producer Prices Decline Iraq is set to resume shipping activity after a
1996-06-14,Government Predicts Gas Will Fall Dime A Gallon Gasoline Prices Expected To Energy Address Whether Oil Government Gasoline Will Fall Dime A Gallon 
1996-06-27,Indonesia Iraq In OilForFood Talks 
1996-06-29,Energy Prices Decline 
1996-07-03,Oil Deregulation Means Higher Prices Less Service 
1996-07-04,Fourth Of July FillUp Will Cost Some Cash Travelers Taking 
1996-07-07,American Troops In Saudi Arabia To Guard Oil Supply 
1996-07-17,Crest Petroleum Shares Rated As Good Investment 
1996-07-21,Oil And Gasoline Futures Take A Dive 
1996-08-02,Crude Oil Prices Rise With Crash Theories 
1996-08-04,Product Labels Should Have More Information 
1996-08-18,Report Of Fires Boosts Crude Futures 
1996-08-22,Gasoline Crude Dip On Small Supply Drop 
1996-08-24,Cottons Hot But Soybean Prices Drop 
1996-08-26,Lawmakers Wife Resigns Staff Post 
1996-08-31,Agency Only Causes Destruction 
1996-09-03,Freeze On Iraqi Crude Expected To Lift Prices Turmoil In Iraq Sends Energy Prices Higher Un Freeze Likely To Raise Oil Prices Oil Prices Make Big Leap Following Conflict In Iraq 
1996-09-04,Turmoil In Iraq Sends Energy Prices Higher Economy Energy Prices Rise Sharply Over Iraqi Conflict Crude Oil Soars After Iraqi Attack Iraq Attack Effect Crude Oil Prices Oil Prices Rise On Iraqi Turmoil 
1996-09-07,No More Special Estanislao Oil Levies 
1996-09-08,Heating Oil Futures Hit Highest Level In 5 Years 
1996-09-13,Move In Special 
1996-09-17,Saudi Announcement Drops Energy Futures 
1996-09-23,Persian Gulf May Send Gasoline Prices Climbing 
1996-10-01,Tight Supplies Spell Higher Winter Heating Oil Prices Higher Prices Expected For Home Heating Oil Heating Oil Price Hike Seen 
1996-10-02,Oleary Examining Options On Heating Oil Ways To Thwart Increase In Heating Oil Examined Options Are Studied On Home Heating Oil Diesel Oil Price Hike Looms Erb Chief Tells Senate World 
1996-10-03,Heating Oil Sharply Higher As Stocks Tighten 
1996-10-06,Govt Urged To Junk Oil Firms Adjustment Scheme If 
1996-10-08,Oil Producers May Merge Us Refining Shell Texaco Confirm Talks On Linkup Worldwide Oil Demand Exceeding Predictions 
1996-10-09,Copper Futures Surge On Us Economy Heating Oil Buyers Keep Crude Prices On Thp Hnil 
1996-10-10,Heating Oil Prices Continue To Rise Market Factors Low 
1996-10-11,Singapore Refiners Face Hard Times Lit Asia Are Birring 
1996-10-15,Oil Prices Higher 
1996-10-16,Mainers Nusue To Buy Firewood Rice Of Of Heating Oil Oil Us Stocks Enter Seventh Year Of Historic Bull Run 
1996-10-18,Gasoline Gains After Doe Releases Report 
1996-10-19,Intervention To Cut Heating Oil Prices Is Rejected Prices Of Heating Oil Futures Jump After Government Help Us Will Study Do Futures Markets Have Dampening Impact 
1996-10-20,Higher Heating Oil Prices Seen This Winter 0 Leary Won Step In To Curb Heating Oil Prices 
1996-10-22,Results Mixed Tor Big Oil Companies 
1996-10-23,Oil Prices Stabilize Statewide LongTerm Outlook Remains 
1996-10-24,Dupont Earnings Rise 16 Percent 
1996-10-25,A Costly FillUp Prices Are Up Supplies Down For Home 
1996-10-26,Higher Fuel Price Hikes Without Deregulation Says Oil Firm 
1996-10-29,Judge Rules For Banks In CreditUnion Case 
1996-11-02,Crude Oil Futures Flow To 2Month Low 
1996-11-03,Corn Soybean Futures Lower Excellent Weather Expected To 
1996-11-05,Higher Heating Oil Prices For A Reason 
1996-11-08,Shortage Of Crude Oil Sends Gas Prices Up And Up Less Refining Higher CrudeOil Cost Add To Sharp Rise In 
1996-11-09,Heating Oil Futures Rise Amid Cold Snap Northeast Expected 
1996-11-10,Oil Supply Shortage In Burma Cold Weather Sends Heating Oil Upward 
1996-11-11,Crude Oil Costs Cause Hike In Price At Gas Pumps Higher Crude Oil Prices Cause Jump In Gasoline Prices 
1996-11-25,Crude Oil Up Gas Prices Still Rising At Pumps Heating Oil Cost Hikes Crude Prices Gasoline Prices Rise Along With Crude Oil Costs 
1996-11-26,Iraq Deal May Slow Gushing Oil Prices Opec Ministers Chopper Oil And Gas Rise 
1996-11-27,Copper Oil And Gas Rise 
1996-11-28,Opec Delays Production Talks Energy Futures Up After Un Approval 
1996-11-29,Tanker Sunk By Japanese In 1941 Intact On Ocean Floor 
1996-11-30,Sunken Wwii Tanker Off Coast Still Full Of Oil Oil Tanker Sunk By Japanese Found Off California The Wreck 
1996-12-01,Tanker Sunk By Japanese Found Most Of Oil Ore 
1996-12-06,New York Reuter Stocks Rise On ProfitTaking Bonds Tumble
1996-12-07,Experts Debate Pumping Oil From Tankers Oil Rv David Experts Debate What To Do With Sunken Tanker Find Raises 
1996-12-10,Pump Prices Should Drop With Iraqi Oil Exports 
1996-12-11,Analysts Say Pump Prices Should Decrease Added Supply Should Cut Price Eventually Iraq ReEnters Oil Trade Consumers Skeptical Consumers Mere Trickle Oil Output Down By 70 By Honey A Analysts Pump Prices Should Drop With Iraqi Oil Exports Iraqi Oil Export To Eventually Reduce Pump Prices Gas Prices To Drop With Iraq Oil On The Market  
1996-12-12,Analysts Expect Oil From Iraq To Eventually Lower Gas Prices
1996-12-16,Us Firms Buy First Iraqi Oil Shipments 
1996-12-17,Natural Gas Heating Oil Skyrocket Based On Cold Weather 
1996-12-18,Nation Heating Gasoline Prices Will Rise Experts Say Petroleum Prices Blast Pocketbooks Associated Press New 
1996-12-19,Heating Oil Nil Nhces Holding Stead 
1996-12-21,Blue Chips Rise Nasdaq Dips 
1996-12-22,Crude Oil Futures Decline 
1997-01-01,Dow Tumbles At Close Amid New Inflation Worries 
1997-01-03,State Awaits Emergency Heating Funds Prices Continued From Page 1a 
1997-01-04,Oil Gas Costs May Stay High Heating Oil Prices To Remain High Heating Oil Prices Not Likely To Cool Off 10 To 15 Cents Heating Oil Prices To Remain High Gas Prices Going Back Up
1997-01-05,Heating Oil Prices Expected To Remain High Heating Oil Prices To Remain High 
1997-01-06,Prices Tor Neating On Expected To Stay High 
1997-01-07,Oil Pipeline Project Across Peninsula Churches Blame Shell Nigerian Government For Oil Pollution 
1997-01-08,Concept Accelerates First Ever Close Above 6600 
1997-01-09,Stocks Veer Lower As Interest Rates Rise With Oil Prices Environment Japanese Fishermen Battle Russian Gasoline Prices Skyrocket Around State State Briefs 
1997-01-10,China To Purchase 34m Tonnes Of Crude This Year 
1997-01-11,Vintage Files Debt Offering
1997-01-13,Pump Prices On The Rise Pump Average Up 13 Cents Briefs Retail Prices Of Gasoline Rose 1c A Gallon In Past 3 Gas Prices Rise Penny Plus 
1997-01-14,Higher Crude Oil Prices Affect Gasoline 
1997-01-16,Exxon Wants Valdez Let Back Into Sound I Tanker Spilled 
1997-01-18,Warming Forecasts Caus Energy Prices To Retreat 
1997-01-21,Petroleum Anarchy Reigns In Chechnya 
1997-01-23,The Oil Moonshiners Reign As As Chechnya Tries To Recover Chechens Turn To DoItYourself Refining Gas Isnt The In Brief Chechens Leave Farming For Oil Business 
1997-01-24,Chechnyas Oil Fields Still Mired In Anarchy Despite The 
1997-01-25,Prices Of Heating Oil Futures And Natural Gas Warm Up 
1997-01-27,Uas Prices Siay Steady 
1997-01-28,Oil Com Oil Compar Deals Face Deals Face 
1997-01-30,Dow Snaps Losing Skid Despite Another Jittery Day For Bonds
1997-01-31,Wheat Futures Fall To Lowest Levels In 21 Months 
1997-02-07,Crude Oil Prices Decline 
1997-02-08,Energy Prices Dip To Lowest Level Since Fall 
1997-02-09,Energy Prices Take A Fall After Recent Mild Weather 
1997-02-19,Opec Content With Current Oil Prices KnightRipper News 
1997-02-20,Wilmington Morning Star Thursday February 20 1997 Us Trade Deficit Surges 1142 Billion Crude Oil Prices Llons Crude Oil Prices Climb Opec Content With Current Oil Prices KnightRipper News 
1997-02-21,Oil Prices Drop Sharply On Thursday 
1997-02-24,Gas Prices Fall 112 Cents 
1997-02-25,Crude Oil Disaster 
1997-02-28,Oil Futures Prices Fall 
1997-03-04,High Winds Impede 
1997-03-05,Overseas Oil Dependence Passes 50 Mark 
1997-03-06,The Energy Policy Theres No Crisis Just A Footnote 
1997-03-07,Energy Policy No Crisis Just A Footnote 
1997-03-09,Supply Vs Demand Soybeans Rally To New Highs 
1997-03-11,A Crude Awakening To Gas Price Moves Reduced Demand For Mg Ruei Fuel During Winter 
1997-03-12,Growth In Refining Hikes Jans Oil Demand 
1997-03-13,Emergency Plan Requirement For Ships In Local Waters Higher Oil Prices Expected To Stay Until June 
1997-03-16,Dont Want Oil Tanker To Return By Carey Goldberg 
1997-03-18,Petroleum Oil Prices Lower 
1997-03-21,Economics Politics Fuel South China Sea Row 
1997-03-23,California Survey Says Fuel Prices Are Down Broken Pipeline Blamed For Gas Spill 
1997-03-24,Survey Shows Fuel Prices Down Slightly Nation Analyst Gas Prices Drop At Pump Gas Prices Post Minor Decrease Gasoline Prices Down In Us 
1997-03-26,Heating Oil Futures Rise 
1997-03-27,The Nation Indian Oil Sector Opens Its Doors To Private Groups
1997-03-28,The Nation Indian Oil Sector Opens Its Doors To Private Groups
1997-03-29,Strong Growth Higher Deficit Projected For 1997 Malaysian 
1997-04-04,Gasoline Prices Expected To Take Modest Increases During 1997 Gas Prices Expected To Rise Some This Summer Small Summer Increase In Gas Prices Expected 
1997-04-06,Soybean Corn Crude Oil Pork Futures Drop 
1997-04-08,Summer Prices Expected To Be 2 Cents Summer Prices Be Lower 
1997-04-09,Russia Oil Wealth Squandered In Bashkiria Us Fuel Prices Fall In March 
1997-04-12,Gas Survey Dubuque Pumps Highest Lower But Still At Top 
1997-04-16,Crude Oil Prices Decline 
1997-04-22,Exxon Earnings Record Billion 
1997-04-23,Gasoline Prices Down But Not In California 
1997-04-25,Ibm Spurs Early Rally Stocks Falter On Inflation Fears 
1997-04-26,Oil Prices Fall Despite Cutbacks In Production 
1997-04-27,Exxon Affiliates In Jomi Operations 
1997-04-28,Gas Prices Drop More Than HalfCent A Gallon 
1997-04-30,Heating Oil Prices Rise 
1997-05-04,Unocal A Company Without A Country
1997-05-09,Ongc Shuts Down Gandhar Oilfield
1997-05-13,Well Know Soon If Oil Prices Increase Broken Pipeline Allows Crude Oil To Spill Into Coastal Area Trucks Used To Clean Up Crude Oil 
1997-05-16,Ashland Marathon Announce Alliance 
1997-05-18,Crude Oil Futures Make Gains Page Ran Crude Oil Oil Futures Highest Lowol In In 
1997-05-21,Crude Oil Prices End Lower 
1997-05-23,Gas Races Down For Memorial Day Travelers Stocks Fear Inflation Fall 
1997-05-24,Oil Producers Slash Prices After Fueling Turmoil Of 96 Energy Futures Run Out Of Gas Ahead Of Holiday 
1997-06-04,Savings Seen In ShellMobil On Venture Halff Kim 
1997-06-05,Petrol Consumption Up 
1997-06-06,Coffee Futures Fall On Easy Supply Concerns 
1997-06-07,Oil Energy Prices Decrease 
1997-06-08,Coffee Futures Tumbling On Easing Supply Concerns 
1997-06-09,China To Cut Duties Balance Trade 
1997-06-11,Tanker Explosion Has Little Impact Us Neighborly About Oil Imports 
1997-06-15,Bumi Armada To Recover Investment In Two Years 
1997-06-16,Nation Grand Forks Receives Chunk Of Disaster Aid 
1997-06-17,Hippie Is I Captured Flu Years After Mat Fleeing Trial 
1997-06-18,Oil And Gas An East Texas Commodity 
1997-06-21,RAINWATER FLOWS WITH OIL AND GAS The Washington Post
1997-06-23,Longtime Oil Man Alls Well Stocks C35 Oil Ministers Quarrel Over Sliding Prices 
1997-06-24,Investing Demand For Oil And Gas Bodes Well Oil And Gas 
1997-06-25,Iran Rp Trader Forge Oil Refinery Venture 
1997-06-26,Crude Futures Soar After Opec Agrees To Adhere To Quotas 
1997-06-27,Opec Vows To Halt Cheating On Oil Output Quotas Energy Opec Promises To Stop Pumping Too Much Oil 
1997-06-28,Wwp Applies For Rate Increase In Local Area 
1997-07-01,Crude Oil Prices Climb 
1997-07-02,Tanker Dumps 39 Million Gallons Of Crude Oil In Bay Nationworld Oil Tanker Spills Millions Of Gallons Briefs Japanese Supertanker Spills 4 Million Aallons Of Crude 
1997-07-03,Japan Oil Spill Estimates Lowered  Japans Worst Oil Spill Threatens Rich Fishing Area In Tokvo Oil Spill Threatens Japan Fishing Area Vastly Overestimated Japan Changes Oil Spill Estimates In 
1997-07-04,Tanker Ran Aground Trying To Avoid Collision Oil Amount Much Less Than First Thought Japanese Government Gains Ground On Oil Spill Ok Help 
1997-07-05,Oil Prices Plunge Amid Rumors Of Iraqi Plan 
1997-07-09,Dow Rolls Toward 8000 
1997-07-13,Crude Oil Drivers Needed 
1997-07-15,Crude Oil Prices Drop Heat Drives Up Natural Gas Higher Crude Oil Prices Push Up Petronas Profit 
1997-07-21,TransAlaska Oil Pipeline Notes 20th Anniversary Oil Firms Vow To Freeze Fuel Prices 
1997-07-22,Houston Water Tests Barred From Trial Against Chevron Alaskans Worry About Pipeline 20 Years Later 
1997-08-05,Energy Futures Rise 
1997-08-07,Iraq Clears New Hurdle In Renewing OilSale Plan Iraqi Export News Sends Crude Futures Tumbling 
1997-08-08,Oil Prices Drop For Second Day 
1997-08-13,UAE oil refinery commissioning delayed
1997-08-15,Transport CoOps Back Oil Policy 
1997-08-17,Opinion Facing A New Round Of Price Hikes 
1997-08-22,How Was Oil Formed 
1997-08-26,Thai Shell Passes 100MillionBarrel Phet Crude Production Mark
1997-08-27,Finds Li Finds Of Crude Source Spill 
1997-08-28,Oil Spill Bigger Than Thought Prices Rising This Oil Spill Underestimated 
1997-08-30,Domestic Activities Exploration And Production 
1997-08-31,Petron Clarifies Pricing Scheme 
1997-09-01,Shell Exec Insists New Oil Jr Price Hikes A Must 
1997-09-03,Another Oil Price Hike In The Works Energy Futures Were On The Upswing 
1997-09-06,Transport CoOps Seek TaxFree Fuel Import 
1997-09-09,Oil Price Hike Baseless Peso Other Asian 
1997-09-11,Move To Smash Oil Cartel Gains 
1997-09-13,Energy Prices Flat Before Un Votes On Iraqi Oil Deal 
1997-09-15,Doe Numbers Show No Reason To Hike Petrol Prices Anew 
1997-09-16,Oil Prices Drift Lower 
1997-09-23,Oil Prices Edge Upward Simulated Crisis Exercise Sends Large Group To Area 
1997-09-25,Oil Prices Edge Upward Estrada Revise Oil Deregulation Law Arroyo Scrutinize 
1997-09-27,Are Big Oil Firms Taking Advantage Of Customers 
1997-09-28,Solon Seeks Oil Price Rollback 
1997-09-29,Oil Slick Found Off Platform 
1997-09-30,CrudeOil Slick Reported Weather Chills Natural Gas Futures Heats Up Oil Complex Oil Spill Fouls Coastal Waters 
1997-10-02,Oil Firms Must Explain Price Hikes 
1997-10-03,Soybeans Rise Sharply As World Demand Rises To 
1997-10-04,Crude Products Soar Amid Rising Mideast Tensions Petrol Outlets Shut Down As Sales Fall Govts Help Sought 
1997-10-05,Crude Products Soar Amid Rising Tensions In The Middle East
1997-10-07,Occidental Buys Navy Oil Reserve Imes Post Service Billion Markets Broad Stocks Hit New Highs 
1997-10-08,Dow Moves Within Striking Distance Of Record Terrain 
1997-10-09,A New Player In The Oil Market I Tad Szulc Looks At Chinas 
1997-10-10,Trio Gets 1 Million For Eddie Bauer Case Nation Caltex Shell Urged To Roll Back Prices 
1997-10-13,Oil Importers Fail Nation Traders Insist Further Guarantees 
1997-10-14,Markets Stock Prices Make Some Small Gains I Not Much 
1997-10-15,Explain Side On Oil Tro Solons Told 
1997-10-16,Oil Price Fall Brings Relief To Battered Asians 
1997-10-17,Thai Ship Oil Tanker Collide Off Singapore 25000 Tonnes 
1997-10-19,Oil Slipping Oil Prices Alarm Illinois Well Owners Squelch 
1997-10-22,New York Reuter Dow Rallies On Firms Earnings 
1997-10-27,The Hidden Hand Of Technology 
1997-10-29,Ommodity Roundup 
1997-11-05,Oil Prices Close Lower 
1997-11-07,Role Of Bacteria In Petroleum Extraction Petri Dish 
1997-11-10,Officials Expect Iraqi Threats Will Cause Upswing In Oil Prices Gasoline Prices Still Declining 
1997-11-11,Stocks End Mixed As Early Rally Fades 
1997-11-13,Markets Dow Slides 1 57 Points In Latest Global Selloff 
1997-11-14,Raise To Offset Lpg Burden Higher Contributions To Oil 
1997-11-15,Persian Gulf Tenses Oil Prices Up Slightly Unlike 1991 Oil Prices Steady Despite Crisis 
1997-11-21,Purdue researchers track oil spills effects on sea otters Crude Oil Reserves Amount To 39 Billion Barrels 
1997-11-24,Gas Prices Fall As Crude Slips Summer Ends 
1997-11-25,Kuwait Backs Saudi Call To Lift Ceiling On Oil Output Opec Eyes Hike In Oil Production 
1997-11-29,Opec States At Odds Production Members Will Pump More Oil 
1997-12-01,Oil Prices Drop As Opec Boosts Production Level 
1997-12-02,Oil Prices Fall After Opec Boosts Ceiling OilFutures Prices Drop After Opec Announces It Will Lift 
1997-12-03,Nation Supreme Court Rejects Plea To Reconsider Oil Decision Indians Dug For Oil Long Before Drake 
1997-12-04,Berlin Center Cleanup Nears Completion At Oil Contamination Supreme Court Rejects Plea To Reconsider Oil Decision 
1997-12-06,Oil Futures Increase Slightly As Iraq Halts Crude Exports 
1997-12-08,Holiday Spending Most Shoppers Dont Bother With A Plan Petron Seeks P097Liter Price Hike 
1997-12-10,Petron Seeks P097Liter Price Hike 
1997-12-11,Crude Oil Prices Tumble 
1997-12-13,Oil Futures Prices Slightly Higher 
1997-12-15,Companies Want To Buy Iraqi Oil 
1997-12-16,Valdez Oil A Crude Gift Exxon Valdez Oil Samples The Perfect Stocking Stuffer By 
1997-12-17,Slick Gift Valdez Oil Samples Stuff A Stocking With Crude 
1997-12-18,Oil Prices Unchanged 
1997-12-21,Oil Prices Unlikely To Change Much In 98 
1997-12-27,Factory Hopes To Cash In On Kenaf Plant Is Cousin Of 
1997-12-29,Cabinet Sets 3 Flat Tariff Rate On Oil Products Iraqis Will Sell HalfPriced Oil To Jordanians 
1997-12-30,Cabinet Sets 3 Flat Tariff Rate On Oil Products By Eileen Crude Oil Prices Plunge 
