date,title
1986-01-01,Mexico Cuts Crude Oil Price 
1986-01-02,Oil Prices Set To Take Further Cuts 
1986-01-03,Us Firms Cutting Back On Oil Gas Exploration 
1986-01-05,Us Gas Oil Exploration Being Cut Back 
1986-01-06,Upg Falco Canada Ups Canada Notice To Oil Producers 
1986-01-08,Upg Falco Canada Notice To Oil Producers 
1986-01-09,A Texaco Canada Inc Notice To Alberta Crude Oil Producers 
1986-01-10,Oil Pipeline Expansion To Us Border Planned 
1986-01-11,3Year Inflation Rate Lowest In 20 Years 
1986-01-13,Venezuela Reduces HeavyCrude Oil Prices 
1986-01-14,Experts Forecast Sharp Rise In Oil Prices If Mace In Mt 
1986-01-15,US oil demand falls in 1985
1986-01-16,Future Oil Prices Plummet 
1986-01-17,Oil Prices Down 
1986-01-18,Texaco Earnings Drop 
1986-01-19,Oil Futures Prices At Lowest In Decade 
1986-01-21,Speculation Follows Drop In Oil Prices Oil Slump May Bring Deficit Problems Oil Price Decline Could Continue By Kathleen Day Oil Prices Drop As Production Rises Sales Fall Cost Of Drop In Oil Prices May Continue 
1986-01-22,Pressure On Local Oil Prices As North Sea Crude Drops Oil Industry In Chaos Despite Drop In Prices Winners Losers In Oil Price Fall 
1986-01-23,Opec Talks Key To Stability Canadian Oil Price Drops Now Let Gasoline Prices Go Down Oil Market Slows After Big Decline Oil Prices Continue Plunge 
1986-01-24,Oil Price Drop May Hurt Conservation CrudeOil Prices Decline Again 
1986-01-25,World Oil Prices Stabilize Mexico May Cut Output Stocks In Review Retreat Caused By Crude Oil Prices Gas Oil Prices Already Lower Crude Oil Cost Drop Not Shown At Pump 
1986-01-26,Iran To Cut Crude Oil Output In Half In Response To Lower Crude Oil Prices Continue To Slump Opec Other Producers 
1986-01-27,Crude Prices Decline But Not Pump Prices Crude Price Down Gas Should Follow Iran To Cut Crude Oil Output In Half In Response To Lower Ran To Cut Oil Production By Half Iran To Decrease Production Of Oil 
1986-01-28,Local Gas Oil Prices Resisting Slide Oil Company Tax Cuts Approved Price Of Crude Oil Increases For First Time In 2 Weeks Crude Oil Prices Show Gain Many Factors Causing Gains In Oil Prices 
1986-01-29,Oil Companies Enjoy Big Quarter 
1986-01-30,Oil Price Drop Mixed News Sudden Drop In Price Of Oil Is Encouraging 
1986-01-31,Crude Oil Price Cuts Discussed Furious Oil Price War Probably Wont Affect Prices At The Pump Mexico Cuts Oil Prices Mexico Slashes Oil Prices Sending Price Below 20 Mexico Drops Oil Price 4 Per Barrel Mexico Cuts Prices Of Crude Oil 
1986-02-02,Price Of Crude Oil Decline Closed Below 19 A Barrel 
1986-02-03,Crude Oil Prices Continue To Drop State Keeps Pace 
1986-02-04,Gasoline Prices Falling Throughout State 
1986-02-05,Falling Oil Prices Double Blessing Crude Oil Prices Plunge As Low As 1544 A Barrel 
1986-02-06,Falling Oil Prices Double Blessing Falling Oil Prices Could Help Economy Cheaper Oil Could Mean SloBillion Gift Crude Oil Prices Increase To Above 1 6 A Barrel Falling Oil Prices May Curb Inflation Falling Oil Prices Are Called Good Shock To Us Economy 
1986-02-07,Oil Price Drop May Be Double Blessing 
1986-02-08,Falling Oil Prices Should Help Our Economic Growth Prices Of Crude Oil Rise Still Below Start Of Year Crude Oil Prices Rise Sharply But Still Below Previous Week OpenMarket Oil Prices Jump New OpenMarket Oil Prices Rise Sharply 
1986-02-09,OilPrice Drop Creates Some Stock Opportunities 
1986-02-10,Hi Price Drop Makes Opportunity Dont Hurry To Sell Oil Stock It May Be Too Late For Oil Stock Moves 
1986-02-11,Huge Decline In Fuel Costs Reduces Wholesale Prices 
1986-02-12,Market Oil Prices Could Fall To Pre Oil Price Uncertainty Creates Investment Opportunities Egypt Slashes Crude Oil Price Price Drop Worries Producers 
1986-02-13,Oil Prices Keep Falling With No End In Sight Oil Price Drop Creates Stock Opportunities Oil Prices Continue To Fall Mexico Slashes The Price Of Its Crude Oil Again 
1986-02-14,Venezuela Drops Opecs Official Prices For Crude Oil Gasoline Prices Showing Declines At Pump By Don Hopey Us Crude Dips Below Us20 
1986-02-15,Mexico Lowers Oil Oil Prices Slow Inflation Prices Goods Mexico Cuts Oil Prices Again 
1986-02-18,Diesel Costs Go Down Too Prices Plummet For Heating Oil Heating Oil Prices Below 1 A Gallon 
1986-02-19,Crude Oil Falls Below 15 A Barrel Crude Oil Prices Fall Below 15 A Barrel Low Oil Prices May Not Bring Low Gasoline Prices Crude Oil Prices Hit 7Year Low Crude Oil Price Fall A Boon To Motorists Crude Oil Prices Plunge Below 15Barrel Mark Crude Oil Price Dips To 7Year Low 
1986-02-20,Lasting Decline Not Expected In Gas Prices Despite Low Crude  Oil Futures Edna Panel Oks Prices Fall Below 14 Garbage 
1986-02-21,Oil Futures Edna Panel Oks Prices Fall Garbage Fee Hike  Oil Futures Prices Ion Below Up Mark  Oil Futures Slide Below 14 A Barrel 
1986-02-22,A Good Lose For Chemistry  Gasoline This Summer May Hit 8090c Gallon 
1986-02-23,Phillips Letters Pump White Oil Controversy Refiners Breathe A Sigh Of Cheaper Crude Oil Revived The 
1986-02-24,Consumers Not Seeing Oil Price Drop Results 
1986-02-25,Gearing Up For A Crude Case Of Give And Take Happens If And  Pumps Dont Reflect CrudeOil Prices 
1986-02-26,Enjoy Gas Wars While They Last  Retail Prices Rise Only 03 Percent In January 
1986-02-27,Fuel Prices Lag Behind Drop In Crude Oil Cost  NonOpec Producers Blamed For Price Fall 
1986-02-28,Oil Import Tax Running Out Of Gas In Washingtor 
1986-03-01,Jii Tutures Prices Take Large Drop  Market Slow To Reflect Oil Prices  Price Of Main Grade Us Oil Takes A Brief Plunge To Below 1  Warnings Issued Against Oil Tax 
1986-03-02,Lower Gas Prices Trickle And Ripple 
1986-03-03,Bg Gas Prices Falling  Crude Prices Lowest In Eight Years  High Gasoline Prices Curb Travel Survey  Oil Overcharges Could Exceed 10 Billion  Oil Price Drop May Lower Gas Cost Postal Rate Increases  Steel Output Rises Crude Oil Prices Continue Slide 
1986-03-04,Crude Oil Prices Drop To Nearly 12  Oil Price Decline Fails To Slacken  Oil Price Slumps  Oil Prices Continue Slide No End Yet In Sight  Oil Prices Plunge Below 13 A Barrel 8 Oil No Longer  Oil Still Dropping When Will It End Barrel Cost To  Us Crude Oil Price Plunging Toward Production Cost  Us Crude Oil Prices Drop Below 13 A Barrel 
1986-03-05,Abu Dhabi Cuts Crude Prices By One Third  British Crude Oil Drops Below  Economic Index Drops 06 Percent  Gasoline Prices Dropping Unleaded Rates Fall Below 1 For 
1986-03-06,Mexico Egypt Cut Oil Prices Associated Press  Oil Price Drop Causes Closure Of 1500 Texaco Wel  Oil Prices Fall To Below Us12 Situation Could Make Output  Oil Prices Fluctuate  Texaco Closes 1500 Of Kern River Oil Wells  Texaco Closes 1500 Oil Wells  Texaco Closes Down Oil Wells  Us Crude Oil Futures Prices Fluctuate Sharply By Kick 
1986-03-07,Carney Wont Set Crude Oil Base Price  Hot CrudeOil Spill Kills Pair In La  No Floor Price For Oil 
1986-03-09,Canada Mexico Fight Off Saudi Oil In Us  Texaco Closes Down 1500 Oil Wells 
1986-03-10,Oil Traders Awaiting Soviet Pricing Move  The Price Of Crude Oil 
1986-03-11,Revenues Drop With Oil Continued Or With The Alberta And 
1986-03-12,Drive To Increasing Use Of Gasohol Stalling 
1986-03-13,Oil Firms Get Blame For Gas Cost  Oil Prices Post Further Gains By The Associated Press  Oil Profit Producer 
1986-03-14,2 Us Oil Companies Announce 6 Billion In Exploration Cuts  Big Oil Firms Cut Exploration Funding Analysts Fear Country  Oil Companies Cut Oh Exloration Budgets  Oil Firms Slash Exploration Budgets  Sharp Oil Exploration Cuts Set  Shell Not Disturbed By The Slump In Oil Price 
1986-03-15,On Second Thought By Joy Brushort  State To Screen Oil At Surry Street Refinery 
1986-03-16,Refugio Oil Ranks 
1986-03-17,Bca Govt Will Receive 800m Extra From Oil 
1986-03-18,Low Oil Prices Could Threaten SelfSufficiency  Mexicos Fortunes Rise Fall With World Price Of Crude Oil  No Intention Of Regulating Oil Prices Carney Says 
1986-03-19,Oil War Of Nerves Now It Is The Major Oil Companies Turn To 
1986-03-20,24 The Age Thursday 20 March 1986 Business Age Oil Export  Oil And Gas Executives Say Oil Import Fee Is Quick Fix  Oil Prices Put Texas In Slump 
1986-03-21,High Cost At The Gas Pumps Has Ontarios Premier Angry 
1986-03-22,Oil Futures Prices Stage Good Advance  Oil Prices To Stay At Low Levels 
1986-03-23,Gas Prices Plummet  Opec Stalemate Depresses Prices Experts Say They Expect Oil  Very Hard Times Come To Texas In Gas Industry 
1986-03-24,Gasoline Prices Show Biggest Drop Ever  Oil Prices To Level Off For A While 
1986-03-25,Analysts Expect Leveling Of Oil Prices  Analysts Oil May Level Off At 10 To 11 Per Barrel  Analysts Say Oil Prices May Level Off At 1012 Range  Crude Oil Prices May Level About Per Barrel  Oil Price Drop Not Hurting Exports  Opec Failure Triggers Another Oil Price Slide  Opec Unable To Agree On Crude Prices 
1986-03-26,Crude Prices Lowest In 10 Years 
1986-03-27,Citgo Oil Price Cut Further  Fuel Drop But Govt Is Still Ahead 
1986-03-28,Oil Futures Prices Fall Below 12 Mark  Oil Prices Continue Plunge As Opec Fails 
1986-03-29,Oil Futures Drop Below 1 1 A Barrel  Petition Asks State Panel To Hold Oil Price At 20 
1986-03-31,Oil Prices Decline To 8Year Low Point  Oil Prices Plummet Below 11 A Barrel 
1986-04-01,Crude Oil Prices At Record Low  Crude Oil Prices Decline As Low As Per Barrel  Crude Oil Prices Fall Below LlABarrel  Oil Price Levels Continue Tumble  Oil Prices Drop To Lowest Level In Years  Oil Prices Hit New Low  Oil Prices Plunging Lowest Since 77 
1986-04-02,Crude Oil Exports Up 36 In 1985 Statistics Canada Reports Crude Oil Price Down To Us980  Oil Falls Below 10 a Barrel Rebounds on Bush Remarks Oil Falls To Lowest Level Since 1977 Us Seeks Stability In  Oil Price Falls To Mid70s Low Of Under 10  Oil Prices Dip Below 1 0 Mark By Rick Gladstone  Oil Prices Drop Below 10 A Barrel But Price Rises After Us  Oil Prices Rally After Dipping To Lowest Price In Eight Years 
1986-04-03,Opec Not Dead Oil Experts Warn 
1986-04-04,Crude Heating Oil Prices Up A Bit  Us Oil Import Tariff Unlikely Miles 
1986-04-05,On Futures Prices Gain For Fourth Day Press Gain Fourth  Traders Divided Future Of Oil Market 
1986-04-06,Strike Fears Boost Oil Prices 
1986-04-07,Apea Chief Asks For Oil Tax Relief  Norwegian Strike Boosts Price Of North Sea Oil 
1986-04-08,Oil Prices Continue Last Weeks Rally  Protection From Price Increases  States Lose Money From Falling Oil Prices  World Oil Prices Rise 
1986-04-09,Falling Prices Hit Oil Future Market Again Soviet Union  Oil Prices Plunge In Heavy Trading  Reagan Hopes Oil Prices Stabilize  Texaco Economist Warns Of Dangers To Us In Continued 
1986-04-10,Crude Oil Prices Make Some Gains  Market Sends Oil Futures Prices Higher  Sale Of Soviet Crude Caps Oil Price Rally 
1986-04-11,Gasoline Cost Up As Supplies Slow  Oil Prices Tipped To Drop Below Us10  Texaco Opposes Oil Quotas 
1986-04-12,Prices Drop Sharply In March 
1986-04-13,Gasoline Energy Top Prices Decline  Xicos Plan May Pump Oil Price War 
1986-04-14,Oil Industry Not Expected To Reflect Price Fall  Warning Is Issued On Possible Energy Crisis 
1986-04-15,Analysts Warn About Another Energy Crunch  For Us Opec Hikes Market Share  Low Prices Luring Us Back To Opec Oil  New Reliance On Opec Oil Seen As Threat  Opec Increases Us Market  Opec Increasing Us Market Share  Us Oil Imports Increasing From Opec 
1986-04-16,Third Round Of Opec Talks Produces No Agreement  Wilmington Refinery Owner Waits For The Price Of Oil To Rise
1986-04-17,Business Opec Fails Again Saudis May Drive Prices Lower  Falling Oil Prices Spur Strong Surge In Market Trading 
1986-04-18,Opec Ministers Cant Agree On Instant Production Cuts 
1986-04-19,Us Oil Production Drops Off 
1986-04-20,Good Oil On Petrol 
1986-04-21,Its Tough To Buy Just One Barrel Of Oil  Purchasing A Barrel Of Oil Not Easy 
1986-04-22,Even If You Could Buy A Barrel Of Oil Couldnt Find A Use 
1986-04-23,12 The Portsmouth Dirty Times Tuesday April Lose Price 
1986-04-24,Oil Profits Rise For Exxon And Sun Decline For Shell  Shell Bp Blame Oil Price Plunge For Slashed Profits  State Wins Debate Over Oil Earnings  What Our Cheap Oil Really Costs 
1986-04-25,Cheap Oil Will Be Costly In The Long Run  Empty Pockets Seem To End Oil Industrys Golden Dreams 
1986-04-26,Bargain Hunters Eying Oil Stocks  Refining Helps Oil Companies Weather Crude Price Collapse 
1986-04-27,Few Fortunate Some Oil Firms Show Gain Despite Glut  Oilman Ray Stiglitz Says The Low Price Of Crude Will Hurt  Senator Us Selling Oil At Low Prices  Us Oil Reserve Still Important 
1986-04-28,Notice To Oil Producers Public Offer By Northridge  Oil Stocks Looking For The Bottom I Hot Currier  Oil Stocks No Bargain Experts Say 
1986-04-29,Corporate Earnings Decline 
1986-04-30,Ipac Wants Alberta To Boost Oil Price  Our Oil Reserve 
1986-05-01,Falling Oil Prices Could Help Profits  Oil Price Drop Helping Farmers  Rut Or Oil Slide Could Both Help Hurt Farmers 
1986-05-02,What Having Cheap Oil Really Costs 
1986-05-03,Oil Production Pushed  Texaco Canada Plans To Cut Capital Spending 
1986-05-04,Chernobyl Disaster Accelerates Oil Prices  Crude Oil Futures At 9Week High  Oil Sands Workers Are Pulling Up Stakes 
1986-05-05,Farm Scene Lower Oil Prices May Cause Future Shocks  Texaco Cuts Costs 
1986-05-06,Oil Price Drop May Cause Future Shock 
1986-05-07,Cheap Crude May Force Rise In Oil Imports  East May Use Foreign Oil Again  What Cheap Oil Really Costs 
1986-05-08,Low Cost Foreign Oil May Beat Out Alberta Crude  Oil Prices Move Above 15 A Barrel 
1986-05-09,Us May Ban Products Made With Libyan Oil  Us Moves To Ban Libyan Oil Products 
1986-05-10,Short Supplies Rising Demand For Gasoline Drive Up Prices 
1986-05-11,Drop In World Oil Prices Could Cause Problems  Low Oil Prices Spur Growth  Us Gasoline Price Rise Seen For Summ 
1986-05-12,Gas Prices Increasing At Pump  Gasoline Prices Take Unprecedented Climb By Jerry Buck  Summer Gasoline Prices Seen Down By 28 Cents 
1986-05-13,Expect Summer Gas Prices To Be 280 Less Than In 85  Prices For Gasoline This Summer Are Likely To Be Lowest In  Report Summer Gas Prices Lowest Since 79 
1986-05-14,Inflation To Tall Output Grow In 87 
1986-05-15,Increasing Crude Hurts Oil Futures  Minister Defends Cleanup Procedure For Northern Oil Spill 
1986-05-16,Wholesale Prices Dip Again 
1986-05-17,Memorial Day Preparations Push Fuel Prices Beyond 16 Barrier
1986-05-18,Oil Futures Close Above 16 
1986-05-20,Demand For Gasoline Lifts Us Crude To 3Month High  Iran Reduces Oil Shipments  North Sea Oil Prices Up  Prices Of Oil Futures Top 17 A Barrel 
1986-05-21,Drivers Will Enjoy Low Gas Prices  Gas Prices At Pump Are Down 28 Cents  Oil Prices Drop Below 16 A Barrel  Oil Prices Fall To 16 A Barrel In Heavy Trading  Oil Prices Tumble Over 1 A Barrel Quick Drop Wipes Lout  Sharp Plunge In Oil Prices Halts Rally  Volatile Trading Drops Oil Prices To 16 A Barrel 
1986-05-22,Crude Oil Futures Prices Drop Below  Lower Oil Prices Help Some Firms Not Others  Taxes Values Confidence Fall With Oil Prices 
1986-05-24,The Oil Outlook Low Prices Could Undermine Nations Energy 
1986-05-25,Experts Predict Grim Future For Oil  Headed For A New Energy Shock Lower Prices Spur Fears  Lower Oil Prices Raise Fears Of Future Energy Shock  Oil Price Drop There Could Be Trouble Ahead  Will Low Oil Prices Spur Fuel Shock Some Analysts Fear 
1986-05-26,Gas Prices Up Some As Market Follows Tradition 
1986-05-27,New York Oil Price Gains May Be Temporary  Saudi Minister Expects Sharply Rising Oil Prices  Saudi Minister Predicts OilPrice Rise Energy Crisis  Saudi Oil Minister Predicts Price Rise  Saudi Oil Minister Warns Of Enerqv Crisis  Sharp Rise In Oil Prices Expected  Sheik Predicts Oil Crisis Will Hit Within Few Years  Yamani Predicts OilPrice Jump Crisis In Energy 
1986-05-28,Southland Corps decision to sell 50 percent of Citgo
1986-05-29,Few Companies Benefit From Plunge In Oil Costs 
1986-05-30,Albertas Crude Oil Reserves Increase Slightly  Crude Oil Prices Fall  Slight Change Reported In Oil Gas Reserves  Will Lower Oil Prices Now Mean Problems Later 
1986-05-31,Cheap Oil May Bode Ill For Domestic Production 
1986-06-01,Despite Glut A Barrel Of Oil Is Rare By Ken Herman 
1986-06-03,Oil Companies To Pay 25 Million  Oil Glut May Help Us Fight Libyan Sales 
1986-06-04,Warning Sounded Of Possible Future Energy Shocks 
1986-06-05,Bulging Oil Stocks Uiup Energy Futures  Japan Changing Oil Market Attitude  Price Of Crude Oil Dips Briefly Below 13 Us 
1986-06-07,Oil Drops Below 13 A Barrel For First Time In Six Weeks 
1986-06-12,Crude Oil Recovery Helps Toronto Gain  Oil Prices Rebound Despite Predictions  Oil Prices Spurt Unexpectedly  Plunge In Oil Prices Battering Some Debtor Nations 
1986-06-14,Energy Futures In Slump 
1986-06-15,A Crude Problem Buying A Barrel Of Oi A Bargain Is A  Charles Osgood A Crude Problem Buying A Barrel Of Oil A 
1986-06-17,Energy Futures Hurt By Opec New  Talk Of Surplus Oil Sinks Energy Prices 
1986-06-18,Diamond Shamrock Finds Oil Pool 
1986-06-19,Prices Of Gasoline Futures Still Falling 
1986-06-23,Little Hope Seen For Opec Agreement  New Opec Talks Set But Analysts Gloomy  Oil Price Slump Robs Third World Of 70bn 
1986-06-25,Opec Discord Sinks Oil Futures Prices 
1986-06-27,No Panic Over Wider Trade Gap City Av Comment Kowski Martin
1986-06-28,Oil Price Slump Has An Impact On California 
1986-06-29,Oil Futures Market Taking On Added Importance  Opec Ministers Near Agreement 
1986-06-30,Oil Prices May Trigger Energy Shock 
1986-07-01,Agree Strategy Presse In Tin Oil Ant Mil Its Output For  Crude Oil Prices Slide  Forecast Continued Opec Disarray Longer Oil Slump  More Disarray In Opec Longer Oil Slump Seen  Opec Calls It Quits Again Gasoline Prices May Drop  Opec Fails To Pass Plan  Opec Failure May Lower Prices  Opec Leaders Go Home Without Production Pact  Opec Meeting Ends Without Agreements  Opec Talks End In Failure Oil Ministers Cant Agree On New  Production Keeps Oil Prices Below Opecs Expectations 
1986-07-02,Brings Hope For Oil Exports 
1986-07-07,Gasoline Hits Lowest Price In Seven Years  Moves Planned To Stop Oil Buys 
1986-07-08,Dollar Joins Dow In Dramatic Drop  Oil Prices Plunge On World Market  World Oil Prices Fall Sharply 
1986-07-09,14Billion Oil Settlement Reached 
1986-07-10,Oil Futures Rise In Troubled Industry  Opec Boosts Oil Production In Power Play 
1986-07-11,Oil Companies Lower Price They Will Pay For Crude  Oil Slick Off Galveston No Threat To Beaches  World Digest CrudeOil Prices Reported At Lowest Levels In 
1986-07-12,Companies Cut Price Paid For Crude Oil  Oil Firms Cut Crude Prices  Producer Prices Hold After Sharp Dip  Signals On GasolinePrice Trends Are Mixed  Us Majors Cut Crude Price 
1986-07-13,4 Oil Companies Cut Price Of Major American Grade 
1986-07-14,Gas Price Drop Bucks Trend  Gas Prices Continue Slide During Summer  Gasoline Price Down 296 Cents This Year  Gasoline Prices Continue Rare Summertime Slide  Oil Price Drops  Price Of Gas Keeps Falling  Price Of Gasoline Continues Falling  The Increase Is An Effort To Try To Bolster The Mexican Economy
1986-07-15,As Opec Production Swells Global Surplus North Sea Oil  Big Oil Pushes Gas Groceries  Energy Futures Surge In Record Trading  North Sea Oil Dips To 9 Per Barrel  North Sea Oil Price Hits A Barrel  Oil Prices Fall Further Decline Seen Bv Lee A Daniels  Oil Prices Tumbling To Record Lows  Price Of Gasoline Keeps Falling Experts Say Trend Will 
1986-07-16,Downward Spiral For Oil Prices Will Go On  Energy Futures Shoot Up  Heaper Oil Will Benefit Consumers 
1986-07-17,Gas Prices To Rise Experts Predict  Oil Firms Struggling For Survival  Oil Imports Up Highest Since February 81 
1986-07-18,Petrol Price Drop Swallowed Up By Increased Costs 
1986-07-19,Hot Weather Scare Stirs Grain Markets 
1986-07-20,Oil Prices Rise Moderately  Prices Rebound Despite Oil Glut 
1986-07-21,Oil Posts Moderate Gains 
1986-07-22,Cost Of Heating Oil Predicted To Stay Low  Decision Deferred On Oil Parity Price  Lower Gasoline Prices Are Good News For Most Canadians But  Oil Price Increase Linked To Demand  Oil Prices Are Still On Rebound Despite Cutback  Oil Prices Rebound Despite The Glut  Saudi Arabia Kuwait Spearhead Drive To Shore Up Oil Price Speculation Over Opec Triaaers Rise In Oil Prices 
1986-07-23,Dropping Oil Prices May Claim 142000 Jobs  Heating Oil Prices Likely To Drop Again  Imperial Oils Profit Plunges  Low Oil Prices Cost Cuts Reduce Earnings  Lowest Heating Bills In Years Likely Due To Drop In Oil Prices  Oil Industry To Lose Jobs  Oil Prices Nosedive  Small Producers Driven From Oil Patch By Low Prices 
1986-07-24,Winter Heat Cost May Warm Hearts 
1986-07-25,Local Gasoline Prices Falling Again Dip Below 60 Cents At  Political Hopeful Accuses Oil Companies Of Gouging  Standard Oil Reports Quarterly Loss 
1986-07-26,Gas Prices Fall In July 
1986-07-28,Opec Mfmsftrs Facing Crisis 
1986-07-29,Opec Cuts Oil Production 
1986-07-30,Low Prices Will Halt Onshore Oil Exploration Warn Oilmen 
1986-07-31,Another Energy Crisis Called Inevitable  Taxes Keep Gasoline Prices High 
1986-08-01,Petroleum Firms Expect Big Cuts 
1986-08-04,Bass Crude Exports Resume 
1986-08-05,Action May Hike Gas Prices  Crude Oil Prices Jump As Opec Nations Reach Accord On Cuts Follows Lead Mexico Plans Export Cuts On Crude Oil  French Oil Cos Halt Purchase Of Libyan Crude  Opec Accord Creates Sharp Boost In Prices  Opec Action Could Mean Higher Prices For Gasoline  Opec Nations Accept Quota Oil Prices Rise  Opecs Decision Gives Boost To Oil Prices 
1986-08-06,Crude Oil Prices Soar After Announcement Opec Agrees To Cut  Crude Oil Prices Soar Us Gas Prices Pushed Up  Fall Oil Futures Jump In Heavy Trading  Follows Try Lead Mexico Plans Export Cuts On Crude Oil  Fuel Cost Changes At Present Uncertain  Inventory Report Drops Oil Prices  Oil And Gas Prices Increase Sharply Trading Is Volatile  Oil Cut Nut Could Help Us Nroducers  Oil Drops But Pump Rise Likely  Oil Price Surge Follows Opecs Surprise Treaty  Oil Prices Soaring But Some Analysts Doubt Opecs  Opec Action Could Push Gas Prices Up Opec Agrees To Curb  Opec Casts Lifeline To Us Oil Administration Oil Prices  Opec Cutback Boosts Pound Shares And Oil  Opec Moves To Pump Up Gas Prices  Opec Oil Output Limits Shouldnt Hurt Us  Opec OilProduction Cut Shouldnt Hurt Us Economy  Reagan Orders More Crude For Reserve  Some Predict Rise In Price Of Gasoline  The Blade Toledo Ohio Oil Prices Rise As Opec Agrees To Cuts
1986-08-07,As Us Inventories Show Unexpected Reserves Oil Prices  Big Us Crude Stock Halts Oil Price Rise  Exports Of Bass Strait Oil Resume  Gasoline Prices Should Remain Low For A While  Industry Leaders Differ On Oil Price  Oil Companies Increase Payout On Crude  Oil Prices Decline After OneDay Rise  Oil Prices Dip As Report Unexpectedly High Inventories  Oil Prices Retreat In World Market  Oil Reserves Need Filling  President Endorses Stockpiling Crude Oil To 750 Million Barrels Reagan Wants Us To Build Oil Stockpiles  Us Oil Inventory Report Restrains Prices 
1986-08-08,Canadian Oil Prices Dont Need To Increase This Year  Opec Price Truce Is Shaky  Shocked By Oil Price Slump  Sudden Rise In Spot Oil Prices Worries Refiners 
1986-08-09,No Gas Price Hike Needed This Year  Oil Award Becomes State Aid For Needy  Oil Prices Too High To Justify  Prepare To Pay Gas Prices To Go Upward 
1986-08-11,Saudi Oil Output Still High  Unleaded Gas Priced Too High Analysts 
1986-08-12,Coal Company Executive Sees No Major Opec Action Gains  Two More Oil Firms Hike Price Of Gas 
1986-08-13,Ashland Oil Accuses ExOfficial Of Personal Vendetta On Firm  Independents Gasoline Cost Ui  MidYear Results Paint Dismal Picture For Oil  Var News Sends Oil Futures Higher 
1986-08-14,Panhandle White Oil Producers Lose Court Appeal  World Oil Prices SeeSaw Nigeria Cuts Production 
1986-08-16,Price Wars Possible In Gasoline Market  Shedding Light On Heavy Oil What Is Heavy Oil 
1986-08-17,Gas Watcher Sees War At The Pump  Gasoline Prices Might Be Trimmed 
1986-08-18,Analyst Fears Results Of New Gas Wars  Fuel Prices May Fall  Gas Price Wars Loom In Says Analyst  Gasoline Price Cuts Forecast  Nation World Analyst Says Oil Price Wars Coming  Oil Analyst Says Gasoline Price Wars Loom  Price War Erupts In Oil Industry  Undeclared Price War May Mean Further Drop In Price Of Gasoline Undeclared Price War Sets Stage For Gasoline Price Drop  Undeclared Price War To Assist Gas Price Drop 
1986-08-19,Energy Financial Sectors Draw Foreign Investors  Gasoline Dealers Face Company Competition The Companies Are  Soviets Expected To Hike Oil Exports Report Says 
1986-08-21,Rices Am Of Gasoline Futures Advance  Shell Follows Suit Raises Its Buying Price For Crude  Us Analysts Predict ThreePerCent Inflation Increase 
1986-08-22,Large Oil Refiners Boost Price For Crude To 21  Oil Refiners Offer More For Crude  Refiners Increase Price Theyll Pay 
1986-08-23,A Dream Final Pullout May End Search For Northern Oil  Raises Price Of Tapis Crude  Underweight On Integrated Oil Stocks 
1986-08-24,Refineries An Oil Bright Spot 
1986-08-27,Gulf States Ponder Ways To Meet Iranian Threat  Norway May Support Opec Move To Boost Oil Prices 
1986-08-28,Art Buchwald Millionaire Hasbeens  Oil Futures Mixed  Us Boosting Oil Reserves 
1986-08-29,Oil Imports With Little Notice Us Slides Into Trouble 
1986-09-01,Oman Will Reduce Its Oil Production 
1986-09-02,Heating Oil Prices May Remain Low  New York Analysts Heating Oil To Remain A Bargain 
1986-09-03,Price Of Oil Increases 
1986-09-04,Oil Retailing Sectors Push Stocks Higher  Oil Slump Has Already Cost About 50000 Jobs  Opec Solidarity Lifts Oil Futures 
1986-09-05,Oil Industry Calls For Tax Changes  Share Prices Rise To Record In 
1986-09-06,Model Predicts Very Large Increase In Us Oil Imports  Model Sees Hefty Rise In Oil Imports  Prices Likely To Remain Low This Winter In Us 
