title,date
Mccook Grain Market. ,1999-02-03
"Vs To; C, Vi Wen Times Friday. February Business. In Vs. ... ",1999-02-18
Key Indicators. ,1999-02-03
The Tuscaloosa News ,1999-02-18
Key Indicatohb. ,1999-02-17
Key Indicators. ,1999-02-02
Key Indicators. ,1999-02-27
Key Indicators. ,1999-02-12
Key Indicators. ,1999-02-24
Key Indicators. ,1999-02-06
Key Indicators. ,1999-02-04
The 4th Annual. Asia Oil Gas Conference. Petronas In Deals. ,1999-06-02
Tanker Spills Crude Oil In Puget Sound. ,1999-06-28
Slick Busters. ,1999-06-22
Iraq's Largest. Refinery Considered Environmental. Nf Tho ... ,1999-06-06
Oil Spill Reported In North Puget. Sound Associated Prose. ,1999-06-28
"Oil Spill Totals About 1,000 Gallons In Puget. ",1999-06-28
Crude Oil Prices Rise. ,1999-07-01
Warning ,1999-06-08
Gas Prices Are Highest In Area. ,1999-06-12
"Gas, Spark Cause Blast. ",1999-07-01
Cleanup Cancels Avila Beach's Summer. ,1999-06-07
Oil Price Control. ,1999-06-03
Crude-Oil Spill Found In River Near El Dorado. ,1999-06-21
"1,050 Gallons Of Crude Oi Spilled Off Wash, Coast. ",1999-06-28
Warning ,1999-06-08
Cleanup Of Oil Spill In Strait Of Georgia Under Way. ,1999-06-29
Accident At Crude Oil Pipeline Facility. ,1999-06-23
Commodities ,1999-06-24
Anti-Cancer Properties Found In Red Palm Oil. ,1999-06-10
Oil Hits 19-Month High. From J-W Wirk Reports. ,1999-07-01
Cleanup Crews Handle Washington State Spill. ,1999-06-29
Deja Vu As State Consumers Battle Oil Giants Again ,1999-06-15
Gas Prices Rise... ,1999-06-28
Utah Gas Prices Holding Steady. ,1999-06-23
"Business News, Stocks Market Report. Gas Prices Jump ... ",1999-06-23
Spot Metals. ,1999-07-01
The Nation Tanker. Spills Oil In Puget Sound. ,1999-06-28
Whatever Happened To Kittlitz's Murrelet? ,1999-06-05
Briefly Tanker Spills Oil Into Puget Sound. ,1999-06-28
Oil Spilled In Puget Sound. ,1999-06-28
Crude Oil Leads Rise In Imported Goods Cost. ,1999-06-11
Commodities ,1999-06-16
Leaking Oil Pipeline Forces Beach Closure. ,1999-06-06
Cadillac Eldorado. ,1999-06-07
Gas Nrices Iron Nearly 3 Rents. ,1999-06-15
Gas Prices Drop 3 Cents In Three Weeks. ,1999-06-14
Lewiston Morning Tribune ,1999-06-29
Camarillo Calif Gas Prices Drop Nearly Three Cents. ,1999-06-14
Iraq Cracks Down On Gas Smugglers. ,1999-06-04
The Deseret News ,1999-06-01
Las Vegas Better Bet Than Commodities. ,1999-06-03
Oil Spill Reported In Puget Sound. ,1999-06-28
"Rodeo June 12 13. Precorp Receives $100,000 Grant For ... ",1999-06-03
Valdez Captain Begins Sentence. Hazelwood Serving Up Salad ,1999-06-23
Leading The Pack In Lubricant. ,1999-06-13
"Iraq: Us, Britain Blocking Contracts. ",1999-06-14
Ferry Restoration Reveals A Bonus. New Strain Of ... ,1999-06-27
Gateway ,1999-06-28
Sought ,1999-06-16
Captain Moves Service To Kitchen. ,1999-06-23
Senate Panel Studies Bp Amoco-Arco Merger. ,1999-06-25
Alaska ,1999-06-22
Hazelwood Begins Community Service Term. ,1999-06-23
National Briefs Valdez Captain Serving Sentence At Soup Kitchen,1999-06-22
Any Oil And Vinegar? Valdez Captain Navigates Salad. ,1999-06-23
Bilge Of Old Ferry Yields New Oil-Eating Bacteria. ,1999-06-30
Gas Prices Drop 5 Cents. ,1999-06-14
Gas Prices Jump By A Half-Cent. ,1999-06-28
Gasoline Prices Start Leveling Off. Experts Say Not To ... ,1999-06-16
Exxon Valdez Captain Serves Up Sentence At Soup Kitchen. ,1999-06-23
"Two Killed When Gas, Oil Tanks Explode. ",1999-06-30
Toledo Blade ,1999-06-03
1996 Ford Contour. ,1999-06-23
Oil Cleanup To Rip Out Town's Beachfront. ,1999-06-07
Report: Suv Standards Increase Oil Use. Lax Fuel Efficiency ,1999-06-17
Oil Prices Fall Below $18 A Barrel. ,1999-06-19
Lewiston Morning Tribune ,1999-06-23
Mobil Under More... ,1999-06-11
Hazelwood Serves Soup While Serving Sentence. ,1999-06-23
Market: Dow Index Drops For The Third Session In A Row. ,1999-06-24
New Straits Times ,1999-06-07
Store Killing Suspect To Face Sex Charges. ,1999-06-08
Nigeria's New Leader Suspends Contracts. ,1999-06-01
How We See It. Time To Protect Lake Milton ,1999-06-29
Sunflower Oil 7.63 Sunflowers Other 13.69 Crude Oil Prices ... ,1999-06-25
Nato Blasts Serb Refineries Hits Kosovo. ,1999-06-09
Curd? Olios. ,1999-06-21
Curly ,1999-06-01
Lax Mileage On Suvs Costs Billions At The Gas Pumps. ,1999-06-17
Corn Bu Milo 2.75 Cut Soybeans 4.00 Bu Sunflower Oil 7.93 ... ,1999-06-08
Latch Says He'll Seek Residential Nomination ,1999-06-23
The Tuscaloosa News ,1999-06-13
Stocks Rebound And Post Gains. ,1999-06-12
Warning ,1999-06-30
Sarawak Records Trade Surplus Of Rm3.3 Billion ,1999-06-09
Energy Futures. Jump On On Potential Venezuelan Strike. ,1999-06-12
Investigation ,1999-06-10
Nigeria Suspends Contracts. ,1999-06-01
Herald-Journal ,1999-06-10
Briefing ,1999-06-10
Oil Production Cutback Sends Energy Futures Up. ,1999-06-06
The Deseret News ,1999-06-28
Key Indicators. ,1999-06-19
Record-Journal ,1999-06-12
Gas Prices Drop Nearly 3 Cents In Three Weeks. ,1999-06-14
Key Indicators. ,1999-06-25
Fatalitiess Look At Bridge. ,1999-07-01
"2 Killed, 1 Hurt As Tank Explodes. ",1999-07-01
"Livingston, Jem, Reuters Two Men Were Killed And A Third Was ",1999-07-01
Holiday Pump Prices Up. A.... ,1999-06-30
Petronas Gets Green Light To Increase Crude Oil. ,1999-07-14
Crude Oil Futures Slide Toward Close Of Trading. ,1999-07-30
Crude Oil Prices Gush. Fluctuate: Many. Enjoying The Best ... ,1999-07-02
Refinery Explosion Helps Boost Gas Prices To 18-Month High. ,1999-07-30
"Crude Prices, Refinery Blast Help Boost Gas Prices. ",1999-07-31
Gas Prices: Lower Reserves Likely To Keep Pushing Prices Higher,1999-07-31
"Gasoline Prices Reach Highest Level, Still On Rise. ",1999-07-31
Asia Takes Up... ,1999-07-05
Gasoline Prices Jump By 2. Cents ,1999-07-12
Lawrence Journal-World ,1999-07-14
Gas Prices Hit 1 8-Month High. I The Average Price Of Gas ... ,1999-07-31
Prices ,1999-07-31
Gas Prices Hit 18-Month High. ,1999-07-31
"Opec, Refinery Explosions Push Gasoline Prices To 18-Month High",1999-07-31
Gas Prices Hit 18-Month High. ,1999-07-31
Crude Oil Rises To New 19-Month High. ,1999-07-02
News Digest. ,1999-07-31
Oil Price... ,1999-07-19
Opec Sticks To Its Quotas; Gas Costs Rise. I At The Pump: As ,1999-07-31
Sabah Shell Proud Of... ,1999-07-16
Crude Oil Prices Rising. ,1999-07-03
Oil Prices Rise; Gas May Follow. Fill Er Up: An Increase In ... ,1999-07-02
"With Crude Around $20 A Barrel, Producers Think About Spending",1999-07-08
Or Shaved. Honey Cured Ham. I. ,1999-07-21
Gas Prices Climb Again Gainesville Follows The Association ... ,1999-07-31
Gas Prices Hit 18-Month Higl. By Ml. Uzi White Michael White. ,1999-07-31
Crude Prices Rise; Experts Unsure If Gas Will Follow. ,1999-07-02
Lodi News-Sentinel ,1999-07-16
"Prices At The Pump Hold, For Now. Some Areas. The Peak. ",1999-07-02
"Oil Prices Surge, Bu. ",1999-07-02
Senior Menus. ,1999-07-08
Trade Deficit Swells To Record High In May. ,1999-07-21
Us Trade Deficit Swells To Record High In May. ,1999-07-20
Manila Standard ,1999-07-13
Crude Oil Prices Soar To Near Two-Year High. ,1999-07-02
Oil's Rise: As Crude Prices Gush Even Higher; Will Gasoline ... ,1999-07-02
Price For Gas Keeps Escalating. ,1999-07-31
Gasoline Prices At 18-Month High. ,1999-07-31
"The Robesonias, Lumberton, Ncs. Saturday.. It 31.1999 Page ",1999-07-31
Daily News ,1999-07-21
Crude Oil Prices Rise. ,1999-07-01
Crude Oil Prices Are On The Rise Across The Us. ,1999-07-04
Gas Prices Reach 18-Month High. ,1999-07-31
Idaho Gas. Oil Prices On The Rise. ,1999-07-26
"Refinery Troubles Hike Futures For Crude, Gas. ",1999-07-18
"Gas, Spark Cause Blast. ",1999-07-01
Opec Strategy Could Mean Oil Shortage. By The Associated. ... ,1999-07-10
"Opec Cutback, High Demand May Lead To Oil Shortage. An ",1999-07-10
Gas ,1999-07-31
Today's News-Herald ,1999-07-13
"Grains, Soybeans Tumble. ",1999-07-04
"Refinery Troubles Spur Gasoline, Oil Market. ",1999-07-16
Exxon Opposes Duties Asked For Oil-Dumping. ,1999-07-13
Us Trade Deficit Swells To Record High In May. Is Spilling ... ,1999-07-21
Business Mmmm Finance Features. Mmmm Oil Shortage Soon Opec ,1999-07-12
Imports Hit Record High. Trade Deficit Swells In May. The ... ,1999-07-21
Oil Shortage Forecast For Year's End. Market Forces Trigger ,1999-07-11
Apy ,1999-07-13
Surge In Oil Prices Not Seen At Pump. ,1999-07-02
Swells To Another. Record High As Oil Price Soars. ,1999-07-21
Trade Deficit Swells To Record. High In May. By May. ,1999-07-21
End Of Oil Glut To Bring Higher Prices. ,1999-07-26
Trade Deficit Hits Record; Stocks Tumble. ,1999-07-21
Paper Should Continue Its Animal News. ,1999-07-28
Trade Deficit Hits Record Hi. ,1999-07-21
Oil Hits 19-Month High. From J-W Wirk Reports. ,1999-07-01
Gas Prices Reach 18-Month High. ,1999-07-31
Gold Funds Hope To Get Back That Midas Touch. ,1999-07-26
Are Gold Funds The Bargain-Hunters Dream? ,1999-07-25
Nation Oil Costs Threaten To Change Gas Prices. ,1999-07-02
Us Gas Prices Continue To Soar. ,1999-07-31
Are Gold Funds The Bargain-Hunters Dream. ,1999-07-22
Spot Metals. ,1999-07-01
Deficit ,1999-07-20
Gold Ceos. ,1999-07-25
The New Definition Of Prestige In The Luxury Touring Class: ,1999-07-04
Victoria Oil Producers Wary Of Higher Prices. Melony Overton ,1999-07-15
Iraq To Boost Oil Production ,1999-07-15
Lies Peace Timetable. ,1999-07-21
Simonds . ,1999-07-16
Gasoline Prices Up In Latest Us. Survey ,1999-07-12
"Crude Oil, Natural Gas Tops In 97 Mining Sector ",1999-07-23
Expensive School May Never Open Former Oil. Oil Field Has ,1999-07-31
Official: Kansas Oil Industry Might. Official: Kansas Oil ... ,1999-07-14
Federal Regulators: New Online Privacy Laws Not Needed. ,1999-07-13
Say Pipe Set To Fail. 6 Blow Whistle On Alaskan Oil Pipeline ,1999-07-13
Oil Prices Increase . ,1999-07-24
Natural Gas Wells Are Fueling Amish And English Farmers Income,1999-07-06
Employees Issue Warning Concerning Pipeline Disaster. ,1999-07-13
We Mark The Spot. ,1999-07-14
Trade Deficit Swells To Record High In May. I; By Jeannine. ... ,1999-07-20
Trade Deficit Swells To Record High. ,1999-07-19
Higher Oil Prices Boost Pump Costs Nationwide. ,1999-07-23
Trade Deficit Swells To Record High In May. The Trade ... ,1999-07-21
McCook Daily Gazette ,1999-07-30
Sheraton To Get Face Lift. Silver Cos. To Renovate Motel In ,1999-07-02
Escalating Oil. ,1999-07-10
Tv Highlights. Broadcast ,1999-07-06
The Victoria Advocate ,1999-07-06
Earnings Posted. ,1999-07-27
"Oil Prices Shoot To 3 1-Month High. Production Cuts, ... ",1999-09-10
Lyon County Reporter ,1999-09-29
Oil Prices Soaring As Inventory Falls. Bridge News. ,1999-09-10
Crude Oil Price Hike Hits Pumps. ,1999-09-13
"Higher Oil, Gas Prices Likely To Fuel Increase In Winter ... ",1999-09-08
Chevron And Phillips May Form Venture. ,1999-09-21
Prices At Pumps Still Going Up At Utah Stations. Jas Cost ... ,1999-09-22
Prices Arc Up More Than 20 Cents. ,1999-09-03
Oil Companies Try To Settle Fraud Suit. New Tape Is Found ... ,1999-09-03
Business Briefs. By The Associated Press. Oil Prices Reach A ,1999-09-10
"Cold, Hard Cash. It's A Heavy Burden. ",1999-09-26
"Even Though The Oil Stocks Have Surged In Recent Months, ",1999-09-26
Commodities ,1999-09-24
Gasoline Hits 33-Month High; Other Metals Follow Gold Surge. ,1999-09-28
Opec Minister Promises To Maintain Output Quotes. ,1999-09-21
Copper Futures Bouyed By Construction Rate. ,1999-09-19
Bouyed By Construction Rate. ,1999-09-19
Oil Price Rebound Gives Midsize Producers Reason To Drill. ,1999-09-12
"Prices May Heat Up For Winter Home. Ji Fuel, Gas Prices. ",1999-09-20
Commodities ,1999-09-23
State Sees Largest One-Month Increase In Gasoline Prices In ,1999-09-28
Heating Bills Expected To Increase This Winter. Residential ... ,1999-09-08
Sun Journal ,1999-09-08
Oil Output Cap Stays On ,1999-09-20
Aussie Refinery Union Bans Indon Fuel. ,1999-09-10
Around The Nation ,1999-09-13
Markets Stock Traders Have A Big Day Of Gains. ,1999-09-04
Higher Oil Prices Expected. ,1999-09-20
"Travelers Paying More, But Gas Prices Expected To Ease. By ",1999-09-02
Opec Won't Budge On Output; Higher Oil Prices Are Expected,1999-09-21
Nise In Construction Activity Lelps Copper Futures Climb. ,1999-09-19
Daily News ,1999-09-30
Si Barrel The ,1999-09-12
Slight Price Increase At Gas Stations . ,1999-09-13
Daily News ,1999-09-11
Gasoline Prices Hit 3-Year High. ,1999-09-18
Opec Panel Urges Members To Keep Lid On Production ,1999-09-22
Cost Of Keeping Warm Rising. ,1999-09-23
Herald-Journal ,1999-09-21
Crude Oil Futures Drop. ,1999-09-13
Gasoline Prices. Holiday Drivers To Pay Dearly. After A ... ,1999-09-02
Join Us For Our Official. Grand Opening Weekend ... ,1999-09-29
Join Us For Our Official. Grand Opening Weekend ... ,1999-09-30
"Thursday, September 1999. Gas Prices Likely To Recede Soon",1999-09-01
More Winter. ,1999-09-08
Daily News ,1999-09-16
Pain At The Pumps. ,1999-09-06
Letters To The Editor ,1999-09-27
Ias Prices Expected To Ease Alter Labor Uay. ,1999-09-02
California ,1999-09-13
Sabah Enjoys Rm2.23b Trade Surplus. ,1999-09-11
Trade Deficit Swells In July. ,1999-09-21
Briefs News ,1999-09-11
Gas Price Rise Caused By Number Of Factors. Experts Blame ,1999-09-18
American Trade Deficit Swells In July. ,1999-09-21
Four Oil Firms Agree To Payments In Suit . ,1999-09-12
Daily News ,1999-09-08
Gas Prices Rise After Opec Decision ,1999-09-23
Gas Prices Rise After Opec Decision ,1999-09-23
The Madison Courier ,1999-09-18
Lawrence Journal-World ,1999-09-27
State Picks Watchdog To Check On Gas Prices. Attorney ... ,1999-09-24
Money ,1999-09-15
Labor ,1999-09-02
"Interest Rates, Worry Investors. ",1999-09-29
Daily News ,1999-09-18
Stocks ,1999-09-29
Us Experts Approve Romanian Pipeline. ,1999-09-19
Price Outlook For Oil Still Uncertain ,1999-09-11
Utahns May Avoid Big Jump In Heat Bills. ,1999-09-08
"Demand Up, Price Uncertain For Oil. ",1999-09-11
Rising Crude Oil Prices Continue To Affect Gas. ,1999-09-27
Gas Prices Climb Higher. ,1999-09-27
Gasoline Surges More Than A Penny Per Gallon ,1999-09-27
Gasoline Surges More Than A Penny. ,1999-09-27
Crude Oil Costs Push Pump Prices Higher. ,1999-09-13
Nation's Gasoline Prices Surge Except In West. ,1999-09-27
Gas Prices Up Slightly. ,1999-09-13
Gasoline Surges More Than Penny Except For West. ,1999-09-27
Gasoline Surges More Than One Cent. ,1999-09-27
Ten Die When Plane Gasoline Prices Surge Smashes Into ... ,1999-09-27
Gasoline Prices Surge For More Than A Penny Except In West. ,1999-09-27
Heating Bills Expected To Zoom This Winter. ,1999-09-08
Winter Heating Costs May Be Heading Up. ,1999-09-08
Markets Nasdaq Hits Record But Dow Retreats. ,1999-09-11
Ligh Oil Spill Clean Up May Be Finished Today. ,1999-09-24
French Farmers Fight Mcdonald's Domination ,1999-09-08
Rise In Oil Price Pushes Gas Price Up. ,1999-09-13
Daily News ,1999-09-03
Daily Union ,1999-09-08
Higher Heating Bills May Hit Consumers. ,1999-09-08
Shop Till Premium Drops. Car Insurance Advice. ,1999-09-05
Auto Buyers. ,1999-09-04
Oil Prices On The Rise After Opec Considers Cutbacks. ,1999-09-18
Gasoline Prices May Dampen Holiday Fun. ,1999-09-02
Labor Day Travelers Paying More; But Gas Prices Expected To ,1999-09-02
Oil Giant With Acquisition ,1999-09-14
Oil Price Direction Remains Uncertain ,1999-09-11
Ifs If. Fi... ,1999-09-02
Oil Wells Show Recovery . ,1999-09-16
Rise In Crude Likely To Mean Higher Heating Costs In Us. ... ,1999-11-16
Gainesville Sun ,1999-11-19
Today's News-Herald ,1999-11-09
Crude Oil Futures Rise Of Latest Report. ,1999-11-25
Unauthorized Trades Cost Firm $160 Million ,1999-11-30
Petroleum Price Spike May Be Short-Lived. Un Leader Predicts ,1999-11-24
"Michigan Oil, Gas Pipeline Spill Expected To Take Years To ",1999-11-12
Lundington Daily News ,1999-11-12
Crude Oil Futures Surge; Natural Gas Plunges. Holiday ... ,1999-11-23
"Gas Costs, Airfares Are Expected To Swell. By Dave. Carpenter",1999-11-19
Compare Our Kali's. ,1999-12-01
Oil Prices Are Highest Since Persian Gulf War; Prices Will ... ,1999-11-19
"Report: Oil, Gas Production Down. ",1999-11-08
Crude Prices Highest Since Gulf War Consumers Can Expect To ,1999-11-19
Task Force Turns Focus To Refiners' Costs . ,1999-11-08
Task Force On Gas. Prices Turns To Refinery Costs. ,1999-11-09
Corporate Report. ,1999-11-30
Oil Busts Through $25-A-Barrel Again By Dave Carpenter. ,1999-11-14
Commodity Rdp. Pork Bellies Soar On Apparenl Bacon Boom. ,1999-11-13
"Iraq Rejects Food Plan, Vows To Cut Oil Supply. Decided To ",1999-11-24
Daily News ,1999-11-05
Crude-Oil Prices Hit Highest Level Since Gulf War. Customers ,1999-11-19
Oil-Price Surge Jolts Markets As Iraq Halts Exports. ,1999-11-23
Warning ,1999-11-16
Warning ,1999-11-16
Crude Oil Prices Double This Year. ,1999-11-19
Texas State Crude Oil Phone Service Prices Continue Firm ... ,1999-11-18
Crude Prices Highest Since Gulf War; Consumers Can Expect To ,1999-11-19
Business.. Oil Prices Highest Since Gulf War; Consumers Will ,1999-11-19
Crude Oil Prices Climb Higher. ,1999-11-16
Airfare Hikes Should Follow. Swell In In Crude Prices. ,1999-11-19
Today's News-Herald ,1999-11-23
Crude Price Hits Rm101 A Barrel. Costlier Oil Likely But No ... ,1999-11-20
"Rising Prices Will Push Inflation Up, Experts Say. ",1999-11-19
"Rising Prices Will Push Inflation Up, Experts Say. ",1999-11-18
"Gas Price Rise, Higher Air Fares Look Likely. ",1999-11-28
A8 Friday November. Ism 1999 The Ledger. Ova Crude Prices ,1999-11-19
Walk ,1999-11-01
Iraq Aims To Cut Off Oil Exports. ,1999-11-23
Iraqi Oil Cutoff Spurs Price Spike. Go Saddam's Pique At Un. ... ,1999-11-23
Trade Deficit Widens. ,1999-11-18
"30 A Barrel Possible, Say Analysts. Oil Prices Jump After ... ",1999-11-23
Iraqis Await Vote By Un. Officials Say Fuel Ship Ments Will ... ,1999-11-24
Front-Runner Makes Candidacy Official. ,1999-11-19
Rising Prices For Jet Fuel Play Role In Air Fare Hikes. ... ,1999-11-25
Iraq Cuts Oil Exports That Fund Their Food. ,1999-11-21
Driveway ,1999-11-18
Daily News ,1999-11-18
Recent Increase In Oil Prices Rekindles Fear Of Inflation In ... ,1999-11-24
"Oil, Gas Production Down In State. ",1999-11-08
The Tuscaloosa News ,1999-11-28
Lodi News-Sentinel ,1999-11-23
Today's News-Herald ,1999-11-21
"Iraq Pledges To Cut On Oil. Exports, Rejects Extension Of ... ",1999-11-24
Merger With Mobile But Bp-Arco Deal Faces Challenge. Trade ,1999-11-27
Crude Prices. ,1999-11-18
"I! U Composite. 11,03570 +152.61 3,347.11. +7772... ",1999-11-19
Daily News ,1999-11-24
Crude Prices Hit Highest Level Since Gulf War; Consumers ... ,1999-11-19
"Chevron, Coast Guard Work On Louisiana Spill. ",1999-11-27
Cuts Oil Exports That Pay For Food In Protest Of Security ... ,1999-11-23
"Markets Blue Chips, High-Tech Stocks Gain, Overall Market ... ",1999-11-23
Us Trade Deficit Widens In September. ,1999-11-18
Oil Prices At Highest Level Since Gulf War. Motorists Will ... ,1999-11-19
Oil Prices At Highest. Level Since Gulf War. ,1999-11-18
Average Home Heating Oil Price Increases 3 Cents Per Gallon,1999-11-18
Home Oil Heating Oil Price Price Reaches. I Nor Gallon ,1999-11-23
"37,500 Gallons Of Oil Spill From Pipeline. ",1999-11-25
The Ledger. Www Him. Mix... ,1999-11-27
The Tuscaloosa News ,1999-11-27
Iraq Stops Oil Exports To Protest Decision ,1999-11-23
Oil Prices Highest Since 1991. Gas Could Rise To A Gallon By ,1999-11-19
Oil Prices Hit Highest Since Gulf War. ,1999-11-19
Home Heating Oil Prices Continue To Rise In Maine. ,1999-12-01
Commodities ,1999-11-03
Crude Risesas Price Hike. Seen ,1999-11-19
Expect Higher Prices For Winter Heating Fuels. ,1999-11-03
California Gas Probe Finds Nothing Illegal. ,1999-11-23
Oil Prices. ,1999-11-19
Consumer Prices Up Slightly. ,1999-11-18
Oil Prices Hit Highest Level Since Gulf War. ,1999-11-19
Crude Oil Futures Surge To $27 A Barrel. ,1999-11-19
Otts.. Standing Up To Big Companies. Drinker By Jason Zandri,1999-11-18
Lewiston Morning Tribune ,1999-11-30
Nasdaq Feels Big Point Loss. ,1999-11-24
Pipeline Crack Forces Shutdown. ,1999-11-08
"Jump In Gas Prices, Airfares Likely To Follow Oil Price Surge. ",1999-11-19
Oil Prices Continue To Increase. ,1999-11-20
Shippers Say Cargoes Should Be Safe. Millions Of Dollars Has ,1999-11-26
Us Criticizes Shell Deal With Iran ,1999-11-16
Philippine Daily Inquirer ,2000-01-05
Gov't Moves. ,2000-01-06
Oil Prices Back At Highest Levels Since Gulf War. 7 Think ... ,2000-01-19
Oil Firms To Raise Prices Next Month. By Christine A. ... ,2000-01-27
"Local On Dealers Say Prices On Downswing. In Contrast, Us. ",2000-01-31
Oil At Highest Price Since Gulf War Fuel Cost. ,2000-01-20
Bright Outlook For Mastek. Company Set To Start Crude Oil ... ,2000-01-24
Pittsburgh Post-Gazette Monday. January 2000. National It. ... ,2000-01-31
High-Tech Boom Lessens Effects Of Oil Prices. Oil Closes In ,2000-01-22
Refinery Has Potential Buyers With Plant Nearing Closing Day,2000-01-31
300 To Lose Jobs At Venango Refinery. ,2000-01-07
Times Daily ,2000-01-22
Philippine Daily Inquirer ,2000-01-17
Gulf War Oil Prices Are Back. ,2000-01-20
Us Economy Weathering Steep Oil Price Rise. ,2000-01-21
Rising Crude Cost Seen To Trigger Fuel Price Hike. ,2000-01-24
"Crude, Heating Oil Prices Cooling Off. ",2000-01-29
"Motorists Pay More For Fuel. Opec Cuts Pinch Inventories, ... ",2000-01-22
Motorists Paying More For Fuel. ,2000-01-22
Editorialletters ,2000-01-26
"Oil Prices Rising, But Inflation Under Control The The ... ",2000-01-22
Lowered Production Expected To Continue As Oil Tops $28 A ,2000-01-16
"Prices For Oil Products Like Diesel, Gasoline, Jet Fuel And ... ",2000-01-30
Today's News-Herald ,2000-01-22
Oil Prices Surge. February Economy Barely. Flinching; For ... ,2000-01-22
Palace Seeks Gentler Oil Price Increase. ,2000-01-04
Oil Prices Slide Right Off Economy's. ,2000-01-22
Crude Oil Spill In Rio Worst. ,2000-01-20
Today's News-Herald ,2000-01-25
Oil Tops $28 A Barrel. ,2000-01-14
Lowered Production Expected To Continue As On Tops A Barrel,2000-01-16
Prices Of Bonds Up. ,2000-01-22
Rising Oil Prices Not Rattling Economy. ,2000-01-22
Nation Congressman Invites Web Surfers To Read His Policy ,2000-01-10
Economy Hums While Crude Oil. I. Tech Dim. Lech Stocks. ... ,2000-01-22
Oil Firms Defer Price Hike Until. By Othel V. Campos ,2000-01-11
Gas: Higher Prices May Have Resulted In Drive-Off Increases. ,2000-01-26
Sun Journal ,2000-01-24
"Copper, Crude, Corn Advance In Trading. ",2000-01-20
Today's News-Herald ,2000-01-15
"The Robesonias. Lumberton, Ncs. Sunday, January 16, 2000 ",2000-01-16
Oil Prices Heat Up. ,2000-01-22
Lower Crude Costs Cause Gas Price Drop. ,2000-01-10
London Petroleum Prices Surge To Nine-Year High. ,2000-01-20
Kansas Oil Industry Picking Up After Years Of Lagging Prices. ,2000-01-24
Daily News ,2000-01-14
Cold Weather Ignites Natural Gas Prices. ,2000-01-21
Lack Of Y2k Panic Causes Oil Prices Drop. ,2000-01-10
Consumers Start To Feel Effects. Oil Prices Near 9-Year Highs,2000-01-22
Toledo Blade ,2000-01-22
By Dave Carpenter. ,2000-01-22
Oil Has Impact. By Dave Carpenter. ,2000-01-23
Us Energy Chief Says Y2k Preparation Worth The Cost. There ,2000-01-03
Impact By Dave Carpenter. ,2000-01-21
Computer Hacker Mitnick Released From Prison ,2000-01-22
"Oil Costs Soaring. Despite Fuel Price Increases, Inflation ... ",2000-01-22
"Without Y2k Panic, Pump Prices Decline. ",2000-01-10
Gasoline Prices Drop. ,2000-01-10
Gasoline Prices Drop Over Past 3 Weeks. ,2000-01-10
Wall Street. Dow Falls; Investors Shift To Nasdaq. ,2000-01-22
Ill Gas Prices. ,2000-01-10
Oil Futures And Other Energy Commodities Drop. ,2000-01-08
Pipeline Firm Is Punished For Spills. $30 Million Fine Is ... ,2000-01-14
Don't Fear Diesel. ,2000-01-09
Refinery Loss Hits Venango Communities. ,2000-01-12
Ill Prices. ,2000-01-28
Energy Secretary Says Strategic Reserves Won't Be Tapped To ,2000-01-26
Oil Leaks . ,2000-01-14
"Lower Crime On Of Panic Cause Price Price Drc Cause. Mill, ... ",2000-01-10
Erap Backs Oil Exchange. ,2000-01-11
"China To See Increased Production Of Oil, Gas. ",2000-01-10
"Oil Prices Up, Impact On Economy Down. ",2000-01-22
"Us Unflinching As Oil. The Reason: Oil. It The New, ... ",2000-01-22
Briefly Speaking. ,2000-01-15
"Weather, Cuts Spur Increase In Gas Prices. ",2000-01-24
Gas Prices Fall. ,2000-01-10
"Farms, Lands, Ranches. ",2000-01-24
Waycross Journal-Herald ,2000-01-15
Wildlife Threatened By Brazilian Oil Spill. ,2000-01-22
Oil Pipeline Ruptures In Clark County. ,2000-01-30
Rio Oil Spill Hits Nature Preserve. ,2000-01-22
Oil Prices Hit Nine-Year High. ,2000-01-15
The Argus-Press ,2000-01-21
"70 Vehicles Pile Up, Killing 7. ",2000-01-24
Brazilian Oil Spill Threatening Endangered Animals In Swamp,2000-01-19
Commodities ,2000-01-21
15-Month Cd. ,2000-01-29
Oil Prta. ,2000-01-22
Briefly Brazilian Oil Spill Continues To Spread. ,2000-01-23
Counter Attack On Rising Oil Prices: Cutting Your Energy Costs,2000-01-31
Over Higher Oil Prices Hit Truckers Where It Hurts. ,2000-01-26
Gas Prices Dip. ,2000-01-10
Gasoline Prices Drop At The Pump. ,2000-01-10
Crude Oil Pipeline Ruptures In Clark Co. ,2000-01-29
Star-News ,2000-01-30
Improving Technology Helps Cut Your Energy Costs. ,2000-01-30
Gainesville Sun ,2000-01-30
Energy-Efficiency Will Help Save Big. ,2000-01-29
Energy Efficient Technology Can Help Cut Energy Costs. ,2000-01-29
High Costs Of Medicines. ,2000-01-29
Rising Gas Prices Cause For Concern. ,2000-02-25
Gas Prices Continue To Climbas. From In ,2000-02-25
"Amoco, Arco Merger. ",2000-02-03
Price Of Oil Jumps To More Than $30 A Barrel. ,2000-02-15
"Gas Prices To Increase For Summer, Experts Say... 2000 Cmc ",2000-02-25
"Gas Prices. Low Supply Will Keep Cost High, Experts Say. ",2000-02-24
"Gas Prices. Low Supply Will Keep Cost High, Experts Say. ",2000-02-25
Gas ,2000-02-25
Gasoline Prices Expected To Escalate This Summer. ,2000-02-15
Gas Prices: Us. Average A Gallon ,2000-02-25
Gasoline ,2000-02-25
Beaver Country Times ,2000-02-16
From Rage In At Worm. Rep Baldacci Urges Release Of Us. ... ,2000-02-16
"Victoria Advocate, Friday. February Is, 2000 .Latin American ... ",2000-02-18
